youtube_id,description_en,acquired_from,description_ar,recording_date,location_latitude,location_longitude,location,reference_code,type_of_violation
gm0sz7zdaz0,Russian airstrikes against civilians in Karm-Aljabal in Aleppo,Orient News,"
خرق جديد للهدنه بقصف جوي لاول مرة على الاحياء الشرقية",2016-09-18 21:21:00+00:00,,,ALEPPO : Karam al-Jabal, RU_2564,Alleged civilian casualties from Russian attacks
fjI77Xeq6Dk,Russian airstrike in Idlib with cluster bombs,Orient News,استهداف الطيران الروسي لادلب بالقنابل العنقودية,2016-09-13 08:45:00+00:00,,,IDLIB,RU_2566,Alleged civilian casualties from Russian attacks
1ukS5AhI6u8,Russian airstrikes causing 4 causalities from the same family ,Orient News,هجمات الطيران الروسي تقتل أربعة أفراد من أسرة واحدة بكفرناها,2016-09-10 21:24:00+00:00,,,ALEPPO : Kafar Naha,RU_2567,Alleged civilian casualties from Russian attacks
hyFvy01v2EM,25 casualties as a result of Russian airstrikes that targeted a public market in Idlib,Orient News,25 شهيدا بغارات روسية على المدينة,2016-09-10 16:30:00+00:00,,,IDLIB,RU_2568,Alleged civilian casualties from Russian attacks
wyjZ3SVZueI,Casualties as a result of alleged Russian attacks on a bakery ,SMART News Agency,ضحايا في قصف جوي على فرن في حريتان شمال حلب من قبل طيران حربي يرجح أنه روسي,2016-05-27 14:20:00+00:00,,,ALEPPO : Harithan,RU_2563,Alleged civilian casualties from Russian attacks
bbJas2y0lRE,11 civilian casualties and injured as a result of Russian attacks in Aleppo,SMART News Agency - وكالة سمارت للأنباء,11 قتيلاً وجرحى مدنيون في قصف جوي روسي على أحياء بحلب,2016-04-22 09:53:50+00:00,36.1942,37.140459,ALEPPO : Bustan al-Qasr,RU_2562,Alleged civilian casualties from Russian attacks
R1V5I7p99hI,Aleppo_News: the first moment when the Russian aircraft targeted Al-Hobait town in the countryside of Idlib.,شبكة حلب نيوز - Halab News Network,حلب_نيوز : اللحظات الأولى لاستهداف طيران العدوان الروسي بلدة الهبيط في ريف إدلب 2016/3/13,2016-03-13 14:51:12+00:00,35.4387845,36.5363219,IDLIB : Hobait,RU_1001,Alleged civilian casualties from Russian attacks
nWb5Iwa38dk,Russian planes launched a raid on Kafr Nabudeh in Hama countryside ,SMART News Agency - وكالة سمارت للأنباء,الطائرات الروسية تشن غارة على كفرنبودة بريف حماه,2016-03-13 14:31:41+00:00,35.433661,36.49441,HAMA : Kafr Nabudah,RU_1002,Alleged civilian casualties from Russian attacks
sWJWJfYc1o8,"Noureddine, the child who lost his legs as a result of cluster bombs dropped on the city of Duma in Damascus countryside",SMO Syria,نور الدين الطفل الذي فقد ساقيه جراء الصواريخ العنقودية على مدينة دوما بريف دمشق,2016-03-13 11:09:09+00:00,33.5709426,36.3968945,DAMASCUS : Duma,RU_1003,Alleged civilian casualties from Russian attacks
864HZdDbX68,Destruction in al-Atarib as a result of the Russian airstrikes,Syrian Network for Human Rights,حلب – الأتارب: آثار قصف الطيران الحربي يزعم انه روسي المدينة بالصواريخ 11 3 2016,2016-03-12 22:25:20+00:00,36.1393709,36.8234774,ALEPPO : Al atarib,RU_1004,Alleged civilian casualties from Russian attacks
gB2QRDQPUc4,More than 20 air strikes and 200 shells dropped on Kafr Nabudah and its surroundings in Hama countryside,المركز الصحفي السوري-Syrian Press Centre,أكثر من 20 غارة جوية و 200 قذيفة على مدينة كفرنبودة ومحيطها في ريف حماة,2016-03-12 20:43:30+00:00,35.433661,36.49441,HAMA : Kafr Nabudah,RU_1005,Alleged civilian casualties from Russian attacks
pmwaP9GR1i4,Agency Qassioun || Russian aircraft flying in the skies above Kafr Nabudah in Hama countryside ,Qasioun News Agency,وكالة قاسيون|| تحليق طيران الروسي في سماء كفرنبودة بريف حماة 12-3-2016,2016-03-12 18:52:14+00:00,35.433661,36.49441,HAMA : Kafr Nabudah,RU_1006,Alleged civilian casualties from Russian attacks
q87XgPvcLv4,# witness | The first moments military aircraft targeting the town Alhbit Hama countryside in airstrike,شبكة حلب نيوز - Halab News Network,#شاهد | اللحظات الأولى لاستهداف الطيران الحربي لبلدة الهبيط في ريف حماة بغارة جوية 2016/3/12,2016-03-12 15:43:30+00:00,35.4387845,36.5363219,IDLIB : Hobait,RU_1007,Alleged civilian casualties from Russian attacks
6mDLwS5iKa0,Coordinating Palmyra - burning one of the transport of food as a result of shelling of civilian trucks by Russian aviation,Palmyra Coordination,تنسيقية تدمر - احتراق احدى الشاحنات المدنية المخصصة لنقل المواد الغذائية نتيجة قصفها بالطيران الروسي,2016-03-11 19:30:15+00:00,34.55972222,38.31583333,HOMS : Palmyra,RU_1008,Alleged civilian casualties from Russian attacks
zXHpy4xdVmA,Coordinating Palmyra - the effects of the destruction in the homes of civilians resulting from the shelling by the aviation of Russain accupation on the city's ,Palmyra Coordination,تنسيقية تدمر - آثار الدمار في منازل المدنيين الناتج عن قصف طيران الاحتلال_الروسي على المدينة,2016-03-11 16:20:55+00:00,34.55972222,38.31583333,HOMS : Palmyra,RU_1009,Alleged civilian casualties from Russian attacks
VHJ5GXcIIJk,Agency Qassioun | The moment Russian aviation bombed al-Maraj in Damascus countryside.,Qasioun News Agency,وكالة قاسيون| لحظة قصف الطيران الروسي على منطقة المرج بريف دمشق 11-3-2016,2016-03-11 15:40:07+00:00,33.5709426,36.3968945,DAMASCUS : Duma,RU_1010,Alleged civilian casualties from Russian attacks
GuSVsqFDvIc,Coordinating Palmyra - a terrifying video showing heavy shelling on civilians by Russian aircraft.,Palmyra Coordination,تنسيقية تدمر - فيديو مرعب يوضح القصف العنيف على المدنيين من قبل الطيران الروسي 10-3-2016,2016-03-10 17:25:32+00:00,34.55972222,38.31583333,HOMS : Palmyra,RU_1011,Alleged civilian casualties from Russian attacks
37tTE-Zg6zQ,Report: Regime and Russian aircraft bombing forcing camp residents to flee for a second time in the countryside of Latakia,baladi- news,تقرير: قصف النظام والطيران الروسي يجبر سكان المخيمات على النزوح مرة ثانية في ريف اللاذقية,2016-03-09 12:28:10+00:00,35.7874449,36.0372269,LATTAKIA : Jabal Turkman,RU_1012,Alleged civilian casualties from Russian attacks
4aAkadE4vTU,Coordinating Palmyra - the massive destruction caused by Russian aircraft bombing of the city this morning,Palmyra Coordination,تنسيقية تدمر - آثار الدمار الهائل جراء القصف من الطيران الروسي على المدينة صباح اليوم 9-3-2016,2016-03-09 11:43:56+00:00,34.55972222,38.31583333,HOMS : Palmyra,RU_1013,Alleged civilian casualties from Russian attacks
uc6lGcbEC3s,Coordinating Palmyra - one of the Russian aircarft raids on the city's neighborhoods,Palmyra Coordination,تنسيقية تدمر - إحدى غارات الطيران الروسي على أحياء المدينة 9 3 2016,2016-03-09 10:22:39+00:00,34.55972222,38.31583333,HOMS : Palmyra,RU_1014,Alleged civilian casualties from Russian attacks
UGB5Z2JGV-8,Destruction in Idlib as a result of the Russian airstrikes,Syrian Network for Human Rights,إدلب – الناجية: دمارجراء قصف الطيران الحربي يزعم انه روسي البلدة بالصواريخ 8 3 2016,2016-03-09 07:29:46+00:00,35.790646,36.212012,IDLIB : Al-Najeya,RU_1015,Alleged civilian casualties from Russian attacks
ru1RC8-5jtE,Remnants of rocket fired during Russian bombing of the city of al-Lataminah in Hama,المركز الصحفي السوري-Syrian Press Centre,تفجير صاروخ من مخلفات القصف الروسي على مدينة اللطامنة في ريف حماة,2016-03-06 20:22:09+00:00,35.326749,36.621766,HAMA : latamneh,RU_1016,Alleged civilian casualties from Russian attacks
4VGv_YoaynI,Destruction and damage in the field hospital as a result of the Russian airstrikes,Syrian Network for Human Rights,إدلب – الحامدية: دمار في المشفى الميداني جراء قصف طيران حربي يزعم انه روسي بالصورايخ جـ1 15 2 2016,2016-03-06 17:57:53+00:00,"35°36'58.51""N","36°39'18.96""E",IDLIB : Al hamidia,RU_1017,Alleged civilian casualties from Russian attacks
4YvR6SxE8k4,Remnants of cluster bomb dropped during Russian aggression on the city of al-Lataminah in Hama countryside,محمود الحموي-Mahmoud Alhamwi,تفجير صاروخ عنقودي من مخلفات العدوان الروسي على مدينة اللطامنة بريف حماة 6 3 2016,2016-03-06 11:49:52+00:00,35.326749,36.621766,HAMA : latamneh,RU_1018,Alleged civilian casualties from Russian attacks
FPVwqiL_5MM,Destruction in 2 ambulances due to suspected Russian shelling 26 Feb 2016 ,Syrian Network for Human Rights,تضرر سيارتي اسعاف جراء قصف طيران حربي يزعم أنه روسي,2016-03-06 01:17:19+00:00,36.2833397,36.8499899,ALEPPO : Darat Izzah,RU_1019,Alleged civilian casualties from Russian attacks
rIDJQHRcmlY,Desctruction and damage in a school as a result of the Russian airstrikes on Hayyan,Syrian Network for Human Rights,حلب – حيان: دمار في مدرسة جراء قصف طيران الحربي يزعم انه روسي بالصورايخ جـ 2 2 2 2016,2016-03-06 01:17:19+00:00,36.3248097,37.0586887,ALEPPO : Hayyan,RU_1020,Alleged civilian casualties from Russian attacks
7cWXjCm1ES0,Desctruction and damage in Al sheikh qassem mousque as a result of the Russian airstrikes on Hayyan,Syrian Network for Human Rights,حلب – حيان: دمار في مسجد الشيخ قاسم جراء قصف طيران الحربي يزعم انه روسي بالصورايخ جـ2 10 2 2016,2016-03-06 01:17:19+00:00,36.3248097,37.0586887,ALEPPO : Hayyan,RU_1021,Alleged civilian casualties from Russian attacks
SCANedw247E,Destruction in Aleppo as a result of the Russian airstrikes,Syrian Network for Human Rights,حلب – الميسر: دمار في الحي جراء قصف طيران الحربي يزعم انه روسي بالصورايخ 20 2 2016,2016-03-06 01:17:18+00:00,36.1961392,37.1830665,,RU_1022,Alleged civilian casualties from Russian attacks
Ve4Sx2NtLaE,Desctruction and damage in a school as a result of the Russian airstrikes on Hayyan,Syrian Network for Human Rights,حلب – حيان: دمار في مدرسة جراء قصف طيران الحربي يزعم انه روسي بالصورايخ 10 2 2016,2016-03-06 01:17:18+00:00,36.3248097,37.0586887,ALEPPO : Hayyan,RU_1023,Alleged civilian casualties from Russian attacks
2Fav8se5IP8,Desctruction and damage in a school as a result of the Russian airstrikes on Hayyan,Syrian Network for Human Rights,حلب – حيان: دمار في مدرسة جراء قصف طيران الحربي يزعم انه روسي بالصورايخ جـ 1 2 2 2016,2016-03-06 01:17:18+00:00,36.3248097,37.0586887,ALEPPO : Hayyan,RU_1024,Alleged civilian casualties from Russian attacks
cLIKcJaLuIs,Aleppo - Tal Refaat: Destruction as a result of bombing by allegedly Russian warplanes.,Syrian Network for Human Rights,حلب – تل رفعت: دمار جراء قصف طيران الحربي يزعم انه روسي المدينة بالصورايخ جـ2 1 2 2016,2016-03-06 01:17:18+00:00,36°28'36N,37°5′50″E,ALEPPO : Tal Rifaat,RU_1025,Alleged civilian casualties from Russian attacks
a0SNtaT369Y,Destruction in Aleppo as a result of the Russian airstrikes,Syrian Network for Human Rights,حلب – الصاخور: دمار جراء قصف طيران الحربي يزعم انه روسي الحي بالصورايخ 5 2 2106,2016-03-06 01:17:17+00:00,36.2203437,37.1804809,ALEPPO : Sakhour,RU_1026,Alleged civilian casualties from Russian attacks
qpkOBwsBtkQ,A survivor of the bombing of the Russian airline's Hospital # MSF recounts the details of what has happened during hospital bombing,almarra today,‫ناجية من قصف الطيران الروسي لـ ‫#‏مشفى_أطباء‬ _بلا_حدود تروي تفاصيل ما حدث قصف المشفى,2016-03-05 18:02:05+00:00,35.6478097,36.6679429,IDLIB : Maret Numan,RU_1027,Alleged civilian casualties from Russian attacks
yGnNmFs08JI,The suffering of residents in the countryside of the city of Homs in removing the devastation  from homes because of the bombing of the frequent flight,عين على الوطن-Ein ala watan media office,معاناة الاهالي في ريف مدينة حمص في ازالة الدمار عن المنازل بسبب قصف الطيران المتكرر,2016-03-03 15:10:29+00:00,34.91639,36.733818,HOMS,RU_1028,Alleged civilian casualties from Russian attacks
WzTJZfSR9b4,Syria - Damascus: Monitoring the devastation caused by the repeated shelling of the city is Dumaa by Russian aircraft,SMO Syria,سوريا - ريف دمشق : رصد الدمار الذي خلفه القصف المتكرر لمدينة دوما من قبل الطائرات الروسية,2016-03-02 14:09:39+00:00,33.5709426,36.3968945,DAMASCUS : Duma,RU_1029,Alleged civilian casualties from Russian attacks
uz3Xkk2QjSc,The effects of the destruction caused by the bombing of the Russian occupation planes on the city Dumaa Damascus countryside,baladi- news,آثار الدمار جراء قصف طائرات الاحتلال الروسي على مدينة دوما بريف دمشق 2016/3/2,2016-03-02 10:43:29+00:00,33.5709426,36.3968945,DAMASCUS : Duma,RU_1030,Alleged civilian casualties from Russian attacks
XbPoo54Pq9Y,Agency Qassioun | Hama Hirbnafsah Russian aviation penetrates the armistice with several raids on the village,Qasioun News Agency,وكالة قاسيون| ريف حماة حر بنفسة طيران الروسي يخترق الهدنة بعدة غارات على القرية 1-3-2016,2016-03-01 20:51:18+00:00,34.9376702,36.6298663,,RU_1031,Alleged civilian casualties from Russian attacks
K81AE34jHZ8,Civil Defense || heading to al-Zeiniyah village after bombing with ballistic missile 1/3/2016,media.civildefense idlib,الدفاع المدني || التوجه إلى قرية الزعينية بعد قصفها بالصواريخ البالستية 1-3-2016,2016-03-01 16:06:49+00:00,"35°48'45""N","36°19'16""E",IDLIB : Jisr ash-Shughur,RU_1032,Alleged civilian casualties from Russian attacks
2TI2LdkF3NM,"Targeting the main roads to the villages of the western countryside of Jisr al-Shughur
with cluster bombs and the response of the Bdama team 1/3/2016",media.civildefense idlib,أستهداف الطرق الرئيسية لقرى ريف جسر الشغور الغربي بالصواريخ العنقودية وفريق بداما يستجيب 1-3-2016,2016-03-01 15:31:04+00:00,"35°48'45""N","36°19'16""E",IDLIB : Jisr ash-Shughur,RU_1033,Alleged civilian casualties from Russian attacks
yTjc2tlrMBY,Rural southern Hama Hirbnafsah # raids by aviation of the Russian occupation on the town,motasem homs,ريف حماه الجنوبي حربنفسه#غارت من طيران الاحتلال الروسي على البلدة1/3/2016,2016-03-01 15:15:05+00:00,34.9376702,36.6298663,,RU_1034,Alleged civilian casualties from Russian attacks
IdyWg7OlZCg,Aircraft of the Russian occupation violate the ceasefire and bombed the village of Kubeineh in several air raids in Idlib countryside 1/3/2016,baladi- news,طيران الاحتلال الروسي يخرق الهدنة ويقصف قرية كبينة بعدة غارات جوية بريف إدلب 2016/3/1,2016-03-01 14:51:35+00:00,35.9266549,36.6180588,IDLIB,RU_1035,Alleged civilian casualties from Russian attacks
CP7fPYwt-FY,Targeting al-Zeiniyah village with long-range ballistic missiles on the fourth day of the ceasefire 1/3/2016,media.civildefense idlib,أستهداف قرية الزعينية بالصواريخ البالستية بعيدة المدى في يوم الهدنة الرابع 1-3-2016,2016-03-01 13:53:59+00:00,"35°48'45""N","36°19'16""E",IDLIB : Jisr ash-Shughur,RU_1036,Alleged civilian casualties from Russian attacks
yqZIDKCcMjs,Bdama Civil Defence documenting the bombing of the village al-Zeiniyah with ballistic missiles 1/3/2016,media.civildefense idlib,الدفاع المدني بداما يوثق قصف قرية الزعينية بصواريخ البالستية قبل قليل 1-3-2016,2016-03-01 13:44:01+00:00,35.813577,36.217,IDLIB : Bdama,RU_1037,Alleged civilian casualties from Russian attacks
ELSgK_dZ0mo,Strikes and barrels and artillery shelling on Hirbnafsah in the fourth day of the armistice,SMART News Agency - وكالة سمارت للأنباء,غارات وبراميل وقصف مدفعي على حر بنفسه في رابع أيام الهدنة,2016-03-01 11:09:40+00:00,34.9376702,36.6298663,,RU_1038,Alleged civilian casualties from Russian attacks
vCxtHlZ7Gug,A clear violation to the ceasefire: Termala village is targeted by vacuum rockets fired by Russian warplanes.,قناة الجسر الفضائية-Jisr satellite media channel,خرق واضح للهدنة استهداف قرية ترملا بالصواريخ الفراغية من الطيران الحربي الروسي,2016-02-29 19:56:40+00:00,35.6141381,36.5606273,IDLIB : Kafranbel nahiyah,RU_1039,Alleged civilian casualties from Russian attacks
El0hWPbrebc,"Huraytan || A report on the child who survived Russian bombardment of the city 2/2/2016
",المكتب الإعلامي حريتان-Harithan media centre,حريتان || تقرير عن الطفل الذي نجا من القصف الروسي على المدينة بتاريخ 2-2-2016,2016-02-29 17:14:07+00:00,36.287871,37.0838783,ALEPPO : Harithan,RU_1040,Alleged civilian casualties from Russian attacks
yXbaW-PLI2w,Hirbnafsah 36 raid on the third day of the armistice,SMART News Agency - وكالة سمارت للأنباء,36 غارة على حربنفسه في ثالث أيام الهدنة,2016-02-29 16:33:00+00:00,34.9376702,36.6298663,,RU_1041,Alleged civilian casualties from Russian attacks
a3jUg50l0O0,Sham Aleppo Kafr Hamra local council for the town manager denied any presence Al-nosar front in the region,ShaamNetwork S.N.N,شام ريف حلب كفرحمرة مدير المجلس المحلي للبلدة ينفي أي تواجد لجبهة النصرة في المنطقة 29 2 2016,2016-02-29 13:23:26+00:00,36.253303,37.087435,ALEPPO : Kafr hamrah,RU_1042,Alleged civilian casualties from Russian attacks
RtiZGwMP9QM,"Unified Observatory: Talking about breach of the ceasefire in Kafr Zita, Hama countryside",المركز الصحفي السوري-Syrian Press Centre,المرصد الموحد يتحدث عن خرق الهدنة في كفرزيتا بريف حماة,2016-02-29 13:09:10+00:00,35.373461,36.601458,HAMA : KafrZita,RU_1043,Alleged civilian casualties from Russian attacks
P8QlOWPo2CY,"Eyewitnesses assert breaking the ceasefire and Russian planes bombing the city of Dara Aza on Sunday morning
",ShaamNetwork S.N.N,شهود عيان يؤكدون خرق الهدنة وقصف الطائرات الروسية مدينة دارة عزة صباح يوم أمس الأحد 28 2 2016,2016-02-29 13:02:54+00:00,36.2833397,36.8499899,ALEPPO : Darat Izzah,RU_1044,Alleged civilian casualties from Russian attacks
6cdLQiu_aEA,The first violation of the ceasefire by Russian warplanes in Kafr Zita in northern Hama countryside,المركز الصحفي السوري-Syrian Press Centre,أول خرق للهدنة من قبل الطيران الحربي الروسي شمال مدينة كفرزيتا في ريف حماة,2016-02-29 13:02:15+00:00,35.373461,36.601458,HAMA : KafrZita,RU_1045,Alleged civilian casualties from Russian attacks
W5eem2womus,The place where rockets landed,شبكة تلبيسة مباشر-Talbisah network,تفقد مكان سقوط الصواريخ الفراغية من قبل الطيران الحربي الروسي,2016-02-29 12:13:50+00:00,34.8015188,36.7085659,HOMS : Ter Maela,RU_1046,Alleged civilian casualties from Russian attacks
2D6gIwBY4KM,Unified Observatory in the town of Kafr Zita documents warplanes violation and targeting the town airstrike,عين على الوطن-Ein ala watan media office,المرصد الموحد في بلدة كفرزيتا يوثق انتهاك الطيران الحربي واستهداف البلدة بغارة جوية 29\2\2016,2016-02-29 11:37:02+00:00,35.373461,36.601458,HAMA : KafrZita,RU_1047,Alleged civilian casualties from Russian attacks
aDHBb5il-eg,Continuous massacres committed by Russian aerial bombardment on Kobtan Al Jabal town before and after the ceasefeire.,قناة الجسر الفضائية-Jisr satellite media channel,مجازر متكررة للقصف الجوي الروسي على بلدة قبتان الجبل قبل الهدنة و بعدها,2016-02-29 11:33:06+00:00,36.2666667,36.95,ALEPPO : Qabtan al Jabal,RU_1048,Alleged civilian casualties from Russian attacks
5cxGc_bPQ-0,"Russian warplanes targeted farmland north of the city of Kafr Zita
",عين على الوطن-Ein ala watan media office,الطيران الحربي الروسي يستهدف الاراضي الرزعية الواقعة شمال مدينة كفرزيتا 29\2\2016,2016-02-29 10:26:42+00:00,35.373461,36.601458,HAMA : KafrZita,RU_1049,Alleged civilian casualties from Russian attacks
Cz1CO35V6D0,The United Observatory talks about the Russian bombardment on the Kafarzeta city of Hama province on the third day of ceasefire.,محمود الحموي-Mahmoud Alhamwi,المرصد الموحد متحدثاً عن القصف الروسي لمدينة كفرزيتا بريف حماة في ثالث أيام الهدنة 29 2 2016,2016-02-29 09:11:00+00:00,35.373461,36.601458,HAMA : KafrZita,RU_1050,Alleged civilian casualties from Russian attacks
RTbvsehuxmg,Yesterday's violation of the ceasefire by Russian aircraft bombing Darat Izzah city on Sunday morning 28/2/2016,مركز حلب الإعلامي AMC-Aleppo media centre,شهود عيان يؤكدون خرق الهدنة وقصف الطائرات الروسية مدينة دارة عزة صباح يوم أمس الأحد 28-2-2016,2016-02-29 07:38:16+00:00,36.2833397,36.8499899,ALEPPO : Darat Izzah,RU_1051,Alleged civilian casualties from Russian attacks
rWs6k-JkiD4,Russian warplanes break the ceasefire and bombard agricultural fields of the Kafarzeta city of Hama province.,محمود الحموي-Mahmoud Alhamwi,الطيران الحربي الروسي يخرق الهدنة ويقصف الأراضي الزراعية لمدينة كفرزيتا بريفا حماة 29 2 2016,2016-02-29 07:22:12+00:00,35.373461,36.601982,HAMA : KafrZita,RU_1052,Alleged civilian casualties from Russian attacks
8BGh1Xx1BJY,Talbiseh - Homs: Ahmed al-Daqa was killed while dismantling the remnants of the Russian bombing of Talbiseh [GRAPHIC],تجمع ثوار سوريا SRG,تلبيسة -حمص: استشهاد احمد الدقة اثناء تفكيكه لمخلفات القصف الروسي على مدينة تلبيسة,2016-02-28 22:52:40+00:00,34.833601,36.735749,HOMS : Talbisah,RU_1053,Alleged civilian casualties from Russian attacks
leKCpIzJce0,Paneling - Homs: Martyrdom of  Ahmed Sheikh Hamoud by Russain Air raids on the Hirbnafsah front southern countryside of Hama,تجمع ثوار سوريا SRG,تلبيسة - حمص: استشهاد احمد الشيخ حمود بغارات للطيران الروسي على جبهة حربنفسة بريف حماه الجنوبي,2016-02-28 22:03:52+00:00,34.9376702,36.6298663,,RU_1054,Alleged civilian casualties from Russian attacks
n5cbTcYbnPE,"Russian aircraft targeting the village of Hirbnafsah with 25 raids on the second day of the ceasefire
",SMART News Agency - وكالة سمارت للأنباء,الطائرات الروسية تستهدف قرية حربنفسه بـ 25 غارة في اليوم الثاني للهدنة,2016-02-28 19:42:59+00:00,34.9376702,36.6298663,HAMA : Hirbinafsah,RU_1055,Alleged civilian casualties from Russian attacks
TEVkHL-7t90,"Homs: Fourth raid on the town of Teir Maalah by Russian warplanes on the second day of the ceasefire 28/2/2016
",تجمع ثوار سوريا SRG,حمص الغارة الرابعة من الطيران الحربي الروسي على بلدة تيرمعلة ثاني أيام الهدنة28-2-2016,2016-02-28 17:14:13+00:00,34.8015188,36.7085659,HOMS : Ter Maela,RU_1056,Alleged civilian casualties from Russian attacks
8A5cvgQjPTo,Homs: Russian warplanes in the skies above Talbiseh during the second day of the ceasefire 28/2/2016,تجمع ثوار سوريا SRG,حمص تحليق للطيران الحربي الروسي في سماء مدينة تلبيسة خلال ثاني أيام الهدنة 28-2-2016,2016-02-28 16:35:41+00:00,34.833601,36.735749,HOMS : Talbisah,RU_1057,Alleged civilian casualties from Russian attacks
ordHuH554pU,Step || Watch the Russian air strikes on Teir Maalah and the bombing of Talbiseh in a new breach of the ceasefire,Step News Agency,خطوة || شاهد الغارات الجوية الروسية على تيرمعلة و قصف على تلبيسة ضمن خرق جديد للهدنة,2016-02-28 16:20:58+00:00,34.833601,36.735749,HOMS : Talbisah,RU_1058,Alleged civilian casualties from Russian attacks
PlAahjjtUes,Russian warplanes targeting the town of Teir Maalah in the northern countryside of Homs 28/2/2016,عين على الوطن-Ein ala watan media office,الطيران الحربي الروسي يستهدف بلدة تير معلة في ريف حمص الشمالي بالصواريخ28\2\2016,2016-02-28 15:59:29+00:00,34.8015188,36.7085659,HOMS : Ter Maela,RU_1059,Alleged civilian casualties from Russian attacks
7NxwQjZRM8o,"Paneling Russian plane a new kind of raid on the city
",talbisa h,تلبيسة 28 2 2016 طائرة روسية من نوع جديد تغيرعلى المدينة,2016-02-28 15:38:10+00:00,34.833601,36.735749,HOMS : Talbisah,RU_1060,Alleged civilian casualties from Russian attacks
2_n64J0uKlw,Teir Maalah Homs raids by Russian warplanes center of neighborhoods of the town Teir Maalah,motasem homs,تيرمعلة حمص غارات من الطيران الحربي الروسي وسط احياء بلدة تيرمعلة 28/2/2016,2016-02-28 15:07:22+00:00,34.8015188,36.7085659,HOMS : Ter Maela,RU_1061,Alleged civilian casualties from Russian attacks
Zqwxf-UVHZA,Clearing the streets and removing rubble after Russian air strikes,شبكة تلبيسة مباشر-Talbisah network,فتح الطرقات وإزالة الأنقاض نتيجة الغارات الروسية,2016-02-28 12:13:50+00:00,34.833601,36.735749,HOMS : Talbisah,RU_1062,Alleged civilian casualties from Russian attacks
O_Qg0-bl1TY,The Lattameneh Civil Defense restores roads that were destroyed by Russia.,محمود الحموي-Mahmoud Alhamwi,الدفاع المدني في مدينة اللطامنة بريف حماة يُصلح الطرقات التي دمرها الدب الروسي 28 2 2016,2016-02-28 12:08:29+00:00,35.326749,36.621766,HAMA : latamneh,RU_1063,Alleged civilian casualties from Russian attacks
uIxqvG7gTW0,Shelling by Russian aircrafts on Daret Ezzah this morning.,قناة الجسر الفضائية-Jisr satellite media channel,قصف لطيران الروسي على دارة عزة صباح اليوم,2016-02-28 11:54:54+00:00,36.2833397,36.8499899,ALEPPO : Darat Izzah,RU_1064,Alleged civilian casualties from Russian attacks
J3XLbLlmllo,A violation of the ceasefire committed by Russian aircraft in Hirbinafsah in Hama province,SMO Syria,#خرق الهدنة من قبل الطيران الروسي على بلدة حربنفسه بريف حماه 1,2016-02-28 11:22:32+00:00,34.9376702,36.6298663,,RU_1065,Alleged civilian casualties from Russian attacks
ktAg_2zGmk4,A violation of the ceasefire committed by Russian aircraft in Hirbinafsah in Hama province,SMO Syria,#خرق الهدنة من قبل الطيران الروسي على بلدة حربنفسه بريف حماه 2,2016-02-28 11:22:32+00:00,34.9376702,36.6298663,,RU_1066,Alleged civilian casualties from Russian attacks
h_AtRaC7GxY,Hama south - Hirbnafsah: a field trip to monitor the destruction happening in the town due to the Russian aviation,تجمع ثوار سوريا SRG,ريف حماه الجنوبي - حربنفسة : جولة ميدانية ترصد الدمار الحاصل في البلدة جراء الطيران الروسي,2016-02-28 11:11:15+00:00,34.9376702,36.6298663,,RU_1067,Alleged civilian casualties from Russian attacks
pgU1g9rJyvA,Russian warplanes fly in the atmosphere of the west countryside of Aleppo after the implementation of several raids on Mudbnh Dara Aza,Mohammed Rasoul,تحليق الطران الحربي الروسي في أجواء ريف حلب الغربي بعد تنفيذ عدة غارات على مدبنة دارة عزة 28/02/2016,2016-02-28 04:54:25+00:00,36.2833397,36.8499899,ALEPPO : Darat Izzah,RU_1068,Alleged civilian casualties from Russian attacks
dWu-7CLHpvw,#Witness: 8 killed by Russian airstrikes on the town of Kafr Hamra in the northern countryside of Aleppo last night 27/2/2016,مركز حلب الإعلامي AMC-Aleppo media centre,#شاهد ثمانية شهداء جراء قصف جوي روسي على بلدة كفر حمرة بريف حلب الشمالي ليلة أمس 27-2-2016,2016-02-27 17:03:25+00:00,36.253303,37.087435,ALEPPO : Kafr hamrah,RU_1069,Alleged civilian casualties from Russian attacks
OdP2PVrzlNw,"Sham Aleppo countryside Kafr Hamra martyrs the Russian aviation bombarded video very harsh warning
",ShaamNetwork S.N.N,شام ريف حلب كفرحمرة شهداء بقصف للطيران الروسي 27 2 2016 تحذير الفيديو قاسي جداً,2016-02-27 15:01:37+00:00,36.253303,37.087435,ALEPPO : Kafr hamrah,RU_1070,Alleged civilian casualties from Russian attacks
5f0D2T7pEB0,Russian aircrafts commit a massacre in Kafar Hamra in Aleppo just an hour before the ceasefire began.,قناة الجسر الفضائية-Jisr satellite media channel,الطيران الروسي يرتكب مجزرة في كفر حمرا بحلب قبل ساعة واحدة من بدء الهدنة,2016-02-27 14:16:24+00:00,36.253303,37.087435,ALEPPO : Kafr hamrah,RU_1071,Alleged civilian casualties from Russian attacks
eGMGdan99cM,"The massacre of Kafr Hamra
",الدفاع المدني السوري حلب-Aleppo civil defense,lمجزرة كفر حمرة26-2-2016,2016-02-27 13:28:25+00:00,36.253303,37.087435,ALEPPO : Kafr hamrah,RU_1072,Alleged civilian casualties from Russian attacks
-Gf9Ndu6X88,Step || Watch smoke rising after Russian air strikes on the town of Darat Izzah yesterday,Step News Agency,خطوة ||شاهد تصاعد الدخان جراء الغارات الجوية الروسية على مدينة دارة عزة يوم أمس,2016-02-27 12:38:21+00:00,36.2833397,36.8499899,ALEPPO : Darat Izzah,RU_1073,Alleged civilian casualties from Russian attacks
TDtVh9hRva4,"Russian air force in first violation of the truce bombard "" Maaret Alartiqe"" Aleppo",Step News Agency,خرق الهدنة من قبل الطيران الروسي نتيجة القصف على معرة الارتيق,2016-02-27 11:20:16+00:00,36.250556,37.053611,,RU_1074,Alleged civilian casualties from Russian attacks
4hkJXln8qe4,Step || The first violation of the ceasefire by Russian aircraft targeting Ma'arat al-Artiq town in Aleppo countryside 27/2/2016,Step News Agency,خطوة || اول خرق في الهدنة من الطيران الروسي استهدف بلدة معارة الارتيق بريف حلب 27 2 2016,2016-02-27 09:58:58+00:00,36.250556,37.053611,,RU_1075,Alleged civilian casualties from Russian attacks
7YHbL5fqzxY,Two families are missing under rubble as a result of an airstrike. The civil defense team is looking for them. ,الدفاع المدني السوري حلب-Aleppo civil defense,مجزرة كفر حمرة عائلتين تحت الانقاض ومازال البحث جاري من قبل عناص الدفاع المدني عن باقي المفقودين,2016-02-27 09:29:10+00:00,36.253303,37.087435,ALEPPO : Kafr hamrah,RU_1076,Alleged civilian casualties from Russian attacks
3YHxsoFxpgw,Wounded being transported to a field hospital,شبكة تلبيسة مباشر-Talbisah network,نقل أحد الجرجى الى المشفى الميداني,2016-02-27 07:51:15+00:00,34.833601,36.735749,HOMS : Talbisah,RU_1077,Alleged civilian casualties from Russian attacks
Bn2Ak2POvNM,Russian aircrafts bombard Lattameneh with high explosive rockets hours before the ceasefire.  ,محمود الحموي-Mahmoud Alhamwi,قبل الهدنة بساعات الطيران الروسي يقصف مدينة اللطامنة بصواريخ شديدة الإنفجار 27 2 2016,2016-02-27 06:50:09+00:00,35.326749,36.621766,HAMA : latamneh,RU_1078,Alleged civilian casualties from Russian attacks
eQTEryVS0tE,Three families including two female children were pulled out from under the rubble an hour before the ceasefire.,المكتب الإعلامي في مدينة كفرحمرة-Media office in Kafr hamrah,كفرحمرة: مجزرة بحق 3 عائلات بينهم طفلتين تم اخراجهم من تحت الانقاض قبيل الهدنة بساعة 27-2,2016-02-27 06:05:51+00:00,36.253303,37.087435,ALEPPO : Kafr hamrah,RU_1079,Alleged civilian casualties from Russian attacks
tutP7RGejAg,"Talbiseh fires in the houses of civilians as a result of Russian raids
",talbisa h,تلبيسة اشتعال للحرائق في منازل المدنيين نتيجة الغارات الروسية 26 2 2016,2016-02-26 21:28:48+00:00,34.833601,36.735749,HOMS : Talbisah,RU_1080,Alleged civilian casualties from Russian attacks
N8RuGQBLg_0,"Talbiseh injures after Russian bombardment of the city
",talbisa h,تلبيسة 26 2 2016 إصابات القصف الروسي على المدينة,2016-02-26 20:40:20+00:00,34.833601,36.735749,HOMS : Talbisah,RU_1081,Alleged civilian casualties from Russian attacks
jdAeT4JB8CE,"Talbiseh a small child infected as a result of Russian raids on the city
",talbisa h,تلبيسة طفل صغير مصاب نتيجة الغارات الروسية على المدينة 26 2 2016,2016-02-26 20:38:32+00:00,34.833601,36.735749,HOMS : Talbisah,RU_1082,Alleged civilian casualties from Russian attacks
iTnkQ-LJc2Y,"Talbiseh injuring a baby as a result of Russian raids
",talbisa h,تلبيسة اصابة طفل رضيع نتيجة الغارات الروسية 26 2 2016,2016-02-26 20:20:32+00:00,34.833601,36.735749,HOMS : Talbisah,RU_1083,Alleged civilian casualties from Russian attacks
49xFaDikEng,"Talbiseh Homs overnight raids by aviation the Russian occupation targeted city neighborhoods at night
",motasem homs,تلبيسة حمص غارات ليلية من الطيران الاحتلال الروسي يستهدف احياء المدينة ليلا26/2/2016,2016-02-26 20:18:05+00:00,34.833601,36.735749,HOMS : Talbisah,RU_1084,Alleged civilian casualties from Russian attacks
JUnT-TSmfS0,Sham DamascusDumaa martyrs the Russian aviation bombarded video Warning very tough P3,ShaamNetwork S.N.N,شام ريف دمشق دوما شهداء بقصف للطيران الروسي 26 2 2016 تحذير الفيديو قاسي جداً ج3,2016-02-26 19:19:38+00:00,33.5709426,36.3968945,DAMASCUS : Duma,RU_1085,Alleged civilian casualties from Russian attacks
7ar2xfTYKQU,8 killed in raids on military aircraft is Dumaa in the Eastern Ghouta,SMART News Agency - وكالة سمارت للأنباء,8 قتلى في غارات لطائرات حربية على دوما في الغوطة الشرقية,2016-02-26 18:46:08+00:00,33.5709426,36.3968945,DAMASCUS : Duma,RU_1086,Alleged civilian casualties from Russian attacks
wifSUs3akRc,Three raids on villages in the eastern countryside Talbisa in Homs,SMART News Agency - وكالة سمارت للأنباء,ثلاث غارات على قرى ريف تلبيسة الشرقي في حمص,2016-02-26 17:36:20+00:00,34.833601,36.735749,HOMS : Talbisah,RU_1087,Alleged civilian casualties from Russian attacks
myWaa88ML_g,"Shahba Press | The flight of Russian warplanes in the skies of the city of Dara Aza countryside west of Aleppo
",وكالة شهبا برس Shahba Press Agency,شهبا برس | تحليق الطيران الحربي الروسي في سماء مدينة دارة عزة بريف حلب الغربي,2016-02-26 17:00:44+00:00,36.2833397,36.8499899,ALEPPO : Darat Izzah,RU_1088,Alleged civilian casualties from Russian attacks
bpIZDxhEpQ8,"Anadan || Scenes from the ongoing Russian strikes on the city
",المكتب الإعلامي حريتان-Harithan media centre,عندان || مشاهد من الغارات الروسية المستمرة على المدينة 26-2-2016,2016-02-26 15:41:56+00:00,36.2924395,37.041918,ALEPPO : Anadan,RU_1089,Alleged civilian casualties from Russian attacks
WJOKydb7SfY,"Dumaa bombardment and fall of 8 martyrs, including Maleeh family ",Yasser Doumany-ياسر الدوماني,القصف على دوما وسقوط 8شهداء بينهم عائلة المليح 2016.2.26,2016-02-26 15:09:49+00:00,33.5709426,36.3968945,DAMASCUS : Duma,RU_1090,Alleged civilian casualties from Russian attacks
8sICM8kek98,More than 56 raid in the eastern Ghouta Joubar neighborhood before the armistice,SMART News Agency - وكالة سمارت للأنباء,أكثر من 56 غارة على الغوطة الشرقية وحي جوبر قُبيل الهدنة,2016-02-26 15:06:04+00:00,33.5296468,36.3848593,DAMASCUS : Eastern Ghouta,RU_1091,Alleged civilian casualties from Russian attacks
8sICM8kek98,"More than 56 raid in the eastern Ghouta neighborhood Joubar ahead of the armistice
",SMART News Agency - وكالة سمارت للأنباء,أكثر من 56 غارة على الغوطة الشرقية وحي جوبر قُبيل الهدنة,2016-02-26 15:06:04+00:00,33.538893,36.365787,DAMASCUS : Irbin nahiyah,RU_1092,Alleged civilian casualties from Russian attacks
6CuLnr0nFpU,"Step || Saw three Russian fighter jets accompanied by a large cargo aircraft skies  ""the northern countryside  of Homs",Step News Agency,"خطوة || شاهد ثلاثة مقاتلات روسية ترافق طائرة شحن كبيرة بسماء ريف ""حمص الشمالي",2016-02-26 14:41:57+00:00,34.91639,36.733818,HOMS,RU_1093,Alleged civilian casualties from Russian attacks
nnNvNOP8gj0,"Syria - Damascus: air strikes from Russian warplanes on the town of Ein Tarma
",SMO Syria,سوريا - ريف_دمشق : غارات جوية من الطيران الحربي الروسي على بلدة عين ترما,2016-02-26 13:54:45+00:00,33.5709426,36.3968945,DAMASCUS : Duma,RU_1094,Alleged civilian casualties from Russian attacks
MVeoUv2WTJo,Syria - Damascus: 21 rockets fired by Russian warplanes within two minutes target the Jobar district of Damascus.,SMO Syria,سوريا - دمشق : ١٢ صاروخ من الطيران الحربي الروسي على دفعتين استهدفت حي جوبر الدمشقي,2016-02-26 13:04:48+00:00,33.531162,36.336808,DAMASCUS : Jobar,RU_1095,Alleged civilian casualties from Russian attacks
Dwmhl44yebk,Place of the fall of the missiles by Russian occupation airplanes over Dumaa country side of  Damascus,baladi- news,مكان سقوط صواريخ طائرات الاحتلال الروسي على مدينة دوما بريف دمشق 2016/2/26,2016-02-26 12:24:31+00:00,33.5709426,36.3968945,DAMASCUS : Duma,RU_1096,Alleged civilian casualties from Russian attacks
8v-rDg5t71w,Russian warplanes shell the Lattameneh city of Hama northern province.,محمود الحموي-Mahmoud Alhamwi,الطيران الحربي الروسي يقصف مدينة اللطامنة بريف حماة الشمالي 26 2 2016,2016-02-26 12:11:03+00:00,35.326749,36.621766,HAMA : latamneh,RU_1097,Alleged civilian casualties from Russian attacks
lShPPo2vF6M,The Russian occupation airplans launches several air strikes on Jobar neighborhood of Damascus,baladi- news,طيران الاحتلال الروسي يشن عدة غارات جوية على حي جوبر في دمشق 2016/2/26,2016-02-26 12:07:30+00:00,33.531162,36.336808,DAMASCUS : Jobar,RU_1098,Alleged civilian casualties from Russian attacks
vHjinlyS_jw,Syria once again more of a flight by the Russian occupation colony Humaimam countryside of lattakia,motasem homs,مجددا سورياالمزيد من طيران الاحتلالاالروسي الىى مستعمرة حميميم بريف الاذقية 26/2/2016,2016-02-26 11:47:30+00:00,34.91639,36.733818,HOMS,RU_1099,Alleged civilian casualties from Russian attacks
44TUoQY_iIY,"Anadan || Scenes from the strikes of Russian warplanes on city
",المكتب الإعلامي حريتان-Harithan media centre,عندان || مشاهد من الغارات من الطيران الحربي الروسي على المدينة 26-2-2016,2016-02-26 11:08:58+00:00,36.2924395,37.041918,ALEPPO : Anadan,RU_1100,Alleged civilian casualties from Russian attacks
h61TfjoHNLY,"Russian aircraft bombardment on Jobar neighborhood in Damascus
",SMART News Agency - وكالة سمارت للأنباء,قصف من الطائرات الروسية على حي جوبر بدمشق,2016-02-26 10:41:32+00:00,33.531162,36.336808,DAMASCUS : Jobar,RU_1101,Alleged civilian casualties from Russian attacks
GRcfL69aEnk,Agency Qassioun | The moment of launching several Russian raids on the Jobar neighborhood of Damascus,Qasioun News Agency,وكالة قاسيون| لحظة شن عدة غارات روسية على حي جوبر بدمشق 26-2-2016,2016-02-26 10:28:54+00:00,33.5709426,36.3968945,DAMASCUS : Duma,RU_1102,Alleged civilian casualties from Russian attacks
RyaFZJnPYGA,the Russian occupation Aviation bombed Dumaa city by several air strikes in Damascus,baladi- news,طيران الاحتلال الروسي يقصف مدينة دوما بعدة غارات جوية في ريف دمشق 2016/2/26,2016-02-26 09:43:19+00:00,33.5709426,36.3968945,DAMASCUS : Duma,RU_1103,Alleged civilian casualties from Russian attacks
CnbhvstLcpk,"Aleppo || Dozens of strikes from Russian warplanes cities and towns of the northern countryside
",المكتب الإعلامي حريتان-Harithan media centre,حـلـب || عشرات الغارات من الطيران الحربي الروسي على مدن وبلدات الريف الشمالي 26-2-2016,2016-02-26 07:37:41+00:00,36.287871,37.0838783,ALEPPO : Harithan,RU_1104,Alleged civilian casualties from Russian attacks
MxIl4f61YmM,Aftermath of cluster bombs in Ghantoo.,شبكة تلبيسة مباشر-Talbisah network,مخلفات القنابل العنقودية في الغنطو,2016-02-25 15:45:13+00:00,34.8223907,36.6935635,HOMS : Al-Ghantu,RU_1105,Alleged civilian casualties from Russian attacks
P2NjystWXws,Step || View the Russian air raids on the Jobar neighborhood of Damascus,Step News Agency,خطوة || شاهد الغارات الجوية الروسية على حي جوبر الدمشقي,2016-02-25 15:07:31+00:00,33.5709426,36.3968945,DAMASCUS : Duma,RU_1106,Alleged civilian casualties from Russian attacks
PFz0F9BuEF8,"Massive destruction caused by the bombing of Russian warplanes for the city of Al-Lataminah in Hama
",المركز الصحفي السوري-Syrian Press Centre,دمار هائل جراء قصف الطيران الحربي الروسي لمدينة ‫‏اللطامنة في ريف حماة,2016-02-25 14:20:12+00:00,35.326749,36.621766,HAMA : latamneh,RU_1107,Alleged civilian casualties from Russian attacks
9ua9tIY4zm8,"Huraytan || The devastation caused by strikes of Russian warplanes on the city
",المكتب الإعلامي حريتان-Harithan media centre,حريتان || آثار الدمار جراء الغارات الروسية على المدينة 25-2-2016,2016-02-25 13:59:36+00:00,36.287871,37.0838783,ALEPPO : Harithan,RU_1108,Alleged civilian casualties from Russian attacks
1xTD0euEw2U,Consecutive air strikes carried out by Russia leave large destruction in the Lattameneh city of Hama province.,محمود الحموي-Mahmoud Alhamwi,غارات متلاحقة يشنها الدب الروسي محدثاً دمار هائل في مدينة اللطامنة بريف حماة 25 2 2016,2016-02-25 13:23:45+00:00,35.326749,36.621766,HAMA : latamneh,RU_1109,Alleged civilian casualties from Russian attacks
8hXUlR0PDTM,Qasioun News: Daraa: 3rd airstrike by the russian warplanes over Inkhil city 25-2-2016,Qasion News Agency EN, وكالة قاسيون: درعا: الغارة الجوية الثالثة من قبل الطيران الحربي الروسي على مدينة انخل. 25-2-2016,2016-02-25 12:37:02+00:00,33.015319,36.127467,DARAA : Inkhil,RU_1110,Alleged civilian casualties from Russian attacks
G3Z0j813x6M,Qasioun News: Daraa: Russian warplanes launch an airstrike over Inkhil city 25-2-2016,Qasion News Agency EN, وكالة قاسيون: درعا: الطيران الحربي الروسي ينفذ غارة جوية على مدينة انخل. 25-2-2016,2016-02-25 12:36:47+00:00,33.0176527,36.0882419,DARAA : Inkhil,RU_1111,Alleged civilian casualties from Russian attacks
zwBri4mzuhk,Qasioun news : Russian airstrikes on Eastern Ghouta in countryside of Damascus (1) 24-2-2016,Qasion News Agency EN, وكالة قاسيون: غارات جوية روسية على الغوطة الشرقية في ريف دمشق (1) 24-2-2016,2016-02-25 08:57:59+00:00,33.5296468,36.3848593,DAMASCUS : Eastern Ghouta,RU_1112,Alleged civilian casualties from Russian attacks
8um7Li2d0K4,Qasioun news : Russian airstrikes on Inkhil city in countryside of Daraa 24-2-2016,Qasion News Agency EN, وكالة قاسيون: غارات جوية روسية على مدينة انخل في ريف درعا 24-2-2016,2016-02-24 22:12:06+00:00,33.0176527,36.0882419,DARAA : Inkhil,RU_1113,Alleged civilian casualties from Russian attacks
DKZ1AhfqxYs,Qasioun news : russian airstrikes on Anter hill in northern countryside of Daraa 24-2-2016,Qasion News Agency EN, وكالة قاسيون: غارات جوية روسية على تل عنتر في ريف درعا الشمالي 24-2-2016,2016-02-24 21:52:50+00:00,32.6228886,36.0819402,DARAA,RU_1114,Alleged civilian casualties from Russian attacks
VCBH9VWd6JA,"View Deraa aviation Russian launches air raid on the town of Kafr Nasej
",مؤسسة شاهد الإعلامية-shahed media association,شاهد درعا الطيران الروسي يشن غارة جوية على بلدة كفرناسج,2016-02-24 19:09:33+00:00,33.1502745,36.0392375,DARAA : Kafr Nasij,RU_1115,Alleged civilian casualties from Russian attacks
YUQQahC4fL4,View Aqraba Deraa air strike of the Russian aviation on the town,مؤسسة شاهد الإعلامية-shahed media association,شاهد درعا عقربا غارة جوية من الطيران الروسي على البلدة,2016-02-24 18:50:58+00:00,33.1081569,36.0072227,IDLIB : Aqrabat,RU_1116,Alleged civilian casualties from Russian attacks
rY-gh5IzcsY,Aleppo - Tell Rifaat || Witness: some of the Russian raids on the city to support the PYD,مدينة تل رفعت Tall Refaat City,ريف حلب - تل رفعت || شاهد : بعض من الغارات الروسية التي استهدفت المدينة لمؤازرة الـPYD,2016-02-24 17:32:19+00:00,36°28'36N,37°5′50″E,ALEPPO : Tal Rifaat,RU_1117,Alleged civilian casualties from Russian attacks
xgNcCdkPfwQ, View Anjel Deraa air strike of the Russian aviation targeted the area around the city,مؤسسة شاهد الإعلامية-shahed media association,شاهد درعا انخل غارة جوية من الطيران الروسي تستهدف محيط المدينة,2016-02-24 15:32:11+00:00,33.015319,36.127467,DARAA : Inkhil,RU_1118,Alleged civilian casualties from Russian attacks
Dtto4du2Va8,Aleppo: Claimed Russian warplanes bombed gathering of civilian trucks between Ahras and Harbel 24/12/2015,Syrian Network for Human Rights,حلب: قصف الطيران الحربي يزعم انه روسي بالصورايخ تجمعاً لشاحنات مدنية بين قريتي احرص وحربل 24 12 2015,2016-02-22 22:09:30+00:00,36.40805,37.153231,ALEPPO : Ahras,RU_1119,Alleged civilian casualties from Russian attacks
Fdk0h6BlRGk,Aleppo: Burning trucks as a result of alleged Russian airstrike between Ahras and Harbel 24/12/2015,Syrian Network for Human Rights,حلب:إحتراق شاحنات جراء قصفها بالطيران الحربي يزعم انه روسي بالصورايخ بين قريتي احرص وحربل 24 12 2015,2016-02-22 22:09:30+00:00,36.40805,37.153231,ALEPPO : Ahras,RU_1120,Alleged civilian casualties from Russian attacks
e_H3B8HkEzg,Intensified hovering by Russian aircrafts in Idlib countryside 22/2/2016,almarra today,تحليق مكثف لطائرات العدوان الروسي في ريف ادلب 22-2-2016,2016-02-22 16:04:49+00:00,35.9266549,36.6180588,IDLIB,RU_1121,Alleged civilian casualties from Russian attacks
vKrsvN973vU,Q.News: destruction in Gharnata village in countryside of Homs due to russian airstrikes 22-2-2016,Qasion News Agency EN, وكالة قاسيون: الدمار في قرية غرناطة في ريف حمص جراء الغارات الجوية الروسية. 22-2-2016,2016-02-22 14:53:07+00:00,34.8956213,36.6789216,HOMS : Gharnatah,RU_1122,Alleged civilian casualties from Russian attacks
BVb6y26svzc,Signs of destruction in the Jobar district of Damascus as a result of daily continuous shelling by Russian aircrafts.,SMO Syria,اثار الدمار في حي جوبر الدمشقي جراء القصف اليومي المتكرر من قبل الطيران الروسي,2016-02-21 17:49:28+00:00,33.531162,36.336808,DAMASCUS : Jobar,RU_1123,Alleged civilian casualties from Russian attacks
Qc4uDo-58jQ,"Sham: Aleppo province, Ein Jara: Russian warplanes target the town with cluster bombs.",ShaamNetwork S.N.N,"شام ريف حلب عنجارة الطيران الحربي الروسي يستهدف البلدة بالقنابل العنقودية 21 2 2016
",2016-02-21 17:49:28+00:00,36.2208884,36.943674,,RU_1124,Alleged civilian casualties from Russian attacks
fnLUgTgN1EI,Qasioun news : destruction in Mayser neighborhood in Aleppo due to russian airstrikes 21-2-2016,Qasioun News Agency,وكالة قاسيون: الدمار الذي خلفه الطيران الروسي بحي الميسر بحلب 21-2-2016,2016-02-21 15:01:49+00:00,36.1961392,37.1830665,,RU_1125,Alleged civilian casualties from Russian attacks
Ftt10ETLcL0,Huraytan || Russian warplanes targeting the city with incendiary rockets,المكتب الإعلامي حريتان-Harithan media centre,حريتان || الطيران الحربي الروسي يستهدف المدينة بصواريخ حـارقة 21-2-2016,2016-02-21 14:53:21+00:00,36.287871,37.0838783,ALEPPO : Harithan,RU_1126,Alleged civilian casualties from Russian attacks
jsGf-Ms41Do,Statement of the Maarat Al Nouman Local Council condemns the aggression by Russian warplanes and Assad regime on hospitals.,almarra today,بيان من المجلس المحلي في معرة النعمان ندد بالاعتداء على المشافي من قبل الطيران الروسي ونظام الأسد,2016-02-21 12:47:03+00:00,35.6478097,36.6679429,IDLIB : Maret Numan,RU_1127,Alleged civilian casualties from Russian attacks
MqiIitkCuAM,Statement of the Maarat Al Nouman Local Council,شبكة المعرة الآن-Maret network now,بيان للمجلس المحلي في مدينة معرة النعمان 2016/2/21,2016-02-21 12:30:28+00:00,35.6478097,36.6679429,IDLIB : Maret Numan,RU_1128,Alleged civilian casualties from Russian attacks
Cc8fc8AdMCM,Maara_Media_Center - Sit in in solidarity with the Doctors Without Borders Hospital that was shelled by Russian aircrafts.,maara media center,مركز المعرة الإعلامي -وقفة تضامنية مع مشفى اطباء بلا حدود الذي قصفهو الطيران الروسي,2016-02-21 12:30:07+00:00,35.6478097,36.6679429,IDLIB : Maret Numan,RU_1129,Alleged civilian casualties from Russian attacks
nROEz0F9oC0,Cham Observatory confirms that Russian warplanes targeting the city of Al-Lataminah with 450  cluster bombs mostly did not explode,المركز الصحفي السوري-Syrian Press Centre,مرصد شام يؤكد أن الطيران الروسي استهدف مدينة اللطامنة بـ 450 قنلة عنقودية معظمها لم ينفجر,2016-02-20 20:39:29+00:00,35.326749,36.621766,HAMA : latamneh,RU_1130,Alleged civilian casualties from Russian attacks
rgeJSCKTwAY,# Aleppo-news | The effects of the Russian aviation bombing AL-Myseer neighborhood,شبكة حلب نيوز - Halab News Network,#حلب_نيوز| آثار القصف الطيران الروسي على حي الميسر 20_2_2016,2016-02-20 15:43:43+00:00,36.1961392,37.1830665,,RU_1131,Alleged civilian casualties from Russian attacks
w7ji6OnPUsI,An elderly woman talks about how she fled in tears and the suffering as a result of Russian air strikes on the Bosra Al Sham town of Daraa province.,SMO Syria,إمرأة مسنة تروي قصة نزوحها بدموع والم جراء الغارات الروسية على بلدة بصر الحرير بريف درعا,2016-02-20 15:26:35+00:00,32.8378332,36.3413725,DARAA : Busra al-Harir,RU_1132,Alleged civilian casualties from Russian attacks
abJ4lf9HFeQ,Nearly 500 cluster bomb which targeted town of Al-Lataminah in Hama,المركز الصحفي السوري-Syrian Press Centre,قرابة الـ 500 قنبلة عنقودية التي استهدفت مدينة اللطامنة في ريف حماة,2016-02-20 14:00:12+00:00,35.326749,36.621766,HAMA : latamneh,RU_1133,Alleged civilian casualties from Russian attacks
n7mdNvAV-tw,Russian aircrafts target with cluster bombs the middle of the Lattameneh city of Hama province.,محمود الحموي-Mahmoud Alhamwi,الطيران الحربي الروسي يستهدوف بالقنابل العنقودية وسط مدينة اللطامنة بريف حماة 20 2 2016,2016-02-20 13:10:43+00:00,35.326749,36.621766,HAMA : latamneh,RU_1134,Alleged civilian casualties from Russian attacks
zMmeFoYX3nI,Qasioun News: Daraa: Russian warplanes launch an airstrike over Kafrnasej town 20-2-2016,Qasion News Agency EN, وكالة قاسيون: درعا: الطيران الحربي الروسي ينفذ غارة جوية على بلدة كفرنسيج 20-2-2016,2016-02-20 11:55:52+00:00,32.6228886,36.0819402,DARAA,RU_1135,Alleged civilian casualties from Russian attacks
TMeTbHTRKBk,Qasioun News: Rif Dimashq: Russian warplanes mounting airstrikes over Erbin surroundings 20-2-2016,Qasion News Agency EN, وكالة قاسيون: ريف دمشق: الطيران الحربي الروسي ينفذ غارات جوية على محيط مدينة عربين 20-2-2016,2016-02-20 11:48:19+00:00,33.538893,36.365787,DAMASCUS : Irbin nahiyah,RU_1136,Alleged civilian casualties from Russian attacks
4tffNWs6IYc,Qasioun News: Homs: Destruction caused by the Russian warplanes over Rastan city 20-2-2016,Qasion News Agency EN, وكالة قاسيون: حمص: الدمار الذي خلفه الطيران الحربي الروسي في مدينة الرستن 20-2-2016,2016-02-20 11:47:33+00:00,34.91639,36.733818,HOMS : Rastan,RU_1137,Alleged civilian casualties from Russian attacks
8IEhSN0g2CQ,Cluster bombs that were dropped by Russian warplanes on the Lattameneh city of Hama province.,محمود الحموي-Mahmoud Alhamwi,أكثر من أربع مئة قنبلة عنقودية ألقاها الطيران الحربي الروسي على مدينة اللطامنة بريف حماة 20 2 2016,2016-02-20 08:25:31+00:00,35.326749,36.621766,HAMA : latamneh,RU_1138,Alleged civilian casualties from Russian attacks
7uAF8W3T6x4,Cluster bombs fired by Russian warplanes on the Lattameneh city of Hama province.,محمود الحموي-Mahmoud Alhamwi,قنابل عنقودية قصفها الطيران الحربي الروسي على مدينة اللطامنة بريف حماة 20 2 2016,2016-02-20 06:18:42+00:00,35.326749,36.621766,HAMA : latamneh,RU_1139,Alleged civilian casualties from Russian attacks
R7eNPukKZ1c,Step Agency || Russian aerial shelling on Saraqib and victims among civilians.,Step News Agency,خطوة || قصف جوي روسي على سراقب وضحايا من المدنيين,2016-02-20 02:27:09+00:00,35.863558,36.799534,IDLIB : Saraqib nahiyah,RU_1140,Alleged civilian casualties from Russian attacks
Msu0GAyQNoA,"Watch Deraa air strike of the Russian aviation targeted the town of Kafr Nasej
",مؤسسة شاهد الإعلامية-shahed media association,شاهد درعا غارة جويةمن الطيران الروسي تستهدف بلدة كفرناسج,2016-02-19 19:25:48+00:00,33.1502745,36.0392375,DARAA : Kafr Nasij,RU_1141,Alleged civilian casualties from Russian attacks
q9ovUaLKdVA,Qasioun News: Rif Dimashq: Russian warplanes launching airstrike over Eastern Ghouta 19-2-2016,Qasion News Agency EN,وكالة قاسيون: ريف دمشق: الطيران الحربي الروسي ينفذ غارة جوية على الغوطة الشرقية 19-2-2016,2016-02-19 14:37:27+00:00,33.5296468,36.3848593,DAMASCUS : Eastern Ghouta,RU_1142,Alleged civilian casualties from Russian attacks
6IHV5URj5p4,Step || Movement of exodus taking place in some villages in the countryside of Daraa because of Russian strikes that affect their homes,Step News Agency,خطوة || حركة نزوح تشهدها بعض قرى ريف درعا جراء الغارات الروسية التي تطال منازلهم,2016-02-19 12:02:32+00:00,32.6228886,36.0819402,DARAA,RU_1143,Alleged civilian casualties from Russian attacks
rHYnPGSzRYo,"Anadan || Russian warplanes launches several raids on the city
",المكتب الإعلامي حريتان-Harithan media centre,عندان || الطيران الحربي الروسي يشن عدة غارات على المدينة 19-2-2016,2016-02-19 10:48:39+00:00,36.2924395,37.041918,ALEPPO : Anadan,RU_1144,Alleged civilian casualties from Russian attacks
xaUwqIkNIb4,"Huraytan || Scenes from the Russian raids on the city's neighborhoods
",المكتب الإعلامي حريتان-Harithan media centre,حريتان || مشاهد من الغارات الروسية على أحياء المدينة 19-2-2016,2016-02-19 10:45:06+00:00,36.287871,37.0838783,ALEPPO : Harithan,RU_1145,Alleged civilian casualties from Russian attacks
lwDpFS8FlvY,"Huraytan || Scenes from the strikes of Russian warplanes on the city's neighborhoods
",المكتب الإعلامي حريتان-Harithan media centre,حريتان || مشاهد من الغارات من الطيران الحربي الروسي على أحياء المدينة 19-2-2016,2016-02-19 09:14:49+00:00,36.287871,37.0838783,ALEPPO : Harithan,RU_1146,Alleged civilian casualties from Russian attacks
w3AM-4g6uug,Aleppo News Network || City Huraytan stricken by the Russian Aviation,شبكة حلب نيوز - Halab News Network,شبكة حلب نيوز|| مدينة حريتان المدينة المنكوبة بفعل الطيران الروسي,2016-02-19 08:21:40+00:00,36.287871,37.0838783,ALEPPO : Harithan,RU_1147,Alleged civilian casualties from Russian attacks
l2JbasUWK6s,"Watch Deraa Russian warplanes targeting Tel Hamad airstrike
",مؤسسة شاهد الإعلامية-shahed media association,شاهد درعا الطيران الحربي الروسي يستهدف تل حمد بغارة جوية 17 2 2016,2016-02-18 19:37:19+00:00,32.844545,36.224456,DARAA : Izraa,RU_1148,Alleged civilian casualties from Russian attacks
j4S00rG0aCU,"Step || Watch the first moments of the Russian bombing which targeted the western neighborhoods in Aleppo

",Step News Agency,خطوة || شاهد اللحظات الأولى للقصف الروسي الذي استهدف الأحياء الغربية بمدينة حلب,2016-02-18 18:42:54+00:00,36.2065528,37.0785454,ALEPPO,RU_1149,Alleged civilian casualties from Russian attacks
uhyfDK0r3Vg,Russian warplanes targeting civilian facilities in Idlib countryside,Idleb Press,استهداف الطيران الحربي الروسي للمرافق المدنية بريف ادلب,2016-02-18 17:34:43+00:00,35.9266549,36.6180588,IDLIB,RU_1150,Alleged civilian casualties from Russian attacks
zpsbGbf5yas,"Sham of Aleppo neighborhood Hajj bridge bombing by warplanes Russian successor to martyrs and wounded
",ShaamNetwork S.N.N,شام حلب حي جسر الحج قصف للطيران الحربي الروسي يخلف شهداء وجرحى 18 2 2016,2016-02-18 13:37:56+00:00,36.1821817,37.1424553,ALEPPO : Aljaser,RU_1151,Alleged civilian casualties from Russian attacks
gURSXU_Xsd8,The effects of the devastation in the village Kafr kalben as a result of the bombing by Russian occupation airplanes on the northern Aleppo countryside,baladi- news,آثار الدمار في قرية كفر كلبين نتيجة قصف طائرات الاحتلال الروسي عليها بريف حلب الشمالي2016/2/18,2016-02-18 13:00:19+00:00,36.5564503,37.0847393,ALEPPO : Kafar Kalbin,RU_1152,Alleged civilian casualties from Russian attacks
Jsm0YdxXlhY,# Aleppo_news | The effects of the Russian bombardment of the ancient archaeological homes in Aleppo - Aljlom behind Shaibani Church,شبكة حلب نيوز - Halab News Network,#حلب_نيوز| آثار القصف الروسي على بيوت أثرية في حلب القديمة - الجلوم خلف كنيسة الشيباني 18_2_2016,2016-02-18 12:57:25+00:00,36.584381,37.049911,ALEPPO : Azaz,RU_1153,Alleged civilian casualties from Russian attacks
KHWSb1tQrts,Qasioun News: Daraa: Moment of mounting the airstrike by the Russian warplane 18-2-2016,Qasion News Agency EN,وكالة قاسيون: درعا: لحظة الغارة الجوية من قبل الطيران الحربي الروسي 18-2-2016,2016-02-18 12:39:51+00:00,32.6228886,36.0819402,DARAA,RU_1154,Alleged civilian casualties from Russian attacks
VKheY15TYkM,"Talbiseh injury to a little girl as a result of cluster strikes of the Russian aviation
",talbisa h,تلبيسة 18 2 2016 إصابة طفلة صغيرة نتيجة الغارات العنقودية من الطيران الروسي,2016-02-18 01:24:33+00:00,34.833601,36.735749,HOMS : Talbisah,RU_1155,Alleged civilian casualties from Russian attacks
O112iba830g,Watch Deraa Russian aviation targeted the outskirts of Kaf rnaseg with secound airstrike.,مؤسسة شاهد الإعلامية-shahed media association,شاهد درعا الطيران الروسي يستهدف اطراف بلدة كفرناسج بغارة جوية ثانية,2016-02-17 21:29:52+00:00,33.1502745,36.0392375,DARAA : Kafr Nasij,RU_1156,Alleged civilian casualties from Russian attacks
guu5X_KsVkU,Rocket bombed by Russian warplanes on the revolutionaries stationed against ISIS in the city of Mare`,هادي العبدالله Hadi Alabdallah,صاروخ ألقاه الطيران الحربي الروسي على الثوار المرابطين ضد تنظيم داعش في مدينة مارع,2016-02-17 19:24:20+00:00,36.4814643,37.1968431,ALEPPO : Mar'e,RU_1157,Alleged civilian casualties from Russian attacks
8xy9N-q_QHo,After three weeks of continuous Russian bombardment Ghariyah al-Gharbiyah is almost depopulated.,SMART News Agency - وكالة سمارت للأنباء,بعد ثلاثة أسابيع من القصف الروسي المتواصل الغارية الغربية شبه خالية من السكان,2016-02-17 17:40:32+00:00,32.6830347,36.2054012,DARAA : Western Al-Ghariyah,RU_1158,Alleged civilian casualties from Russian attacks
MKpon4xU4Co,Q.news : the second russian airstrike on Deir-Assafer town in countryside of Damascus 17-2-2016,Qasion News Agency EN,وكالة قاسيون: الغارة الجوية الروسية الثانية على بلدة دير العصافير في ريف دمشق 17-2-2016,2016-02-17 17:00:49+00:00,33.4650336,36.4159012,DAMASCUS : Deir al-Asafir,RU_1159,Alleged civilian casualties from Russian attacks
i1Uk7iQxWks,"""Um Ibrahim"" forced by the Russian bombardment to leave her home and seek safety in camp.",مركز حلب الإعلامي AMC-Aleppo media centre,"""أم إبراهيم"" أجبرها القصف الروسي على الهروب من منزلها واللجوء لخيمة جماعية",2016-02-17 16:48:04+00:00,36.584381,37.049911,ALEPPO : Azaz,RU_1160,Alleged civilian casualties from Russian attacks
XBIKh7ukBR8,"Hama-South Hirbnafsah: violent raids from Russian warplanes on the town
",تجمع ثوار سوريا SRG,ريف حماه الجنوبي- حربنفسة : غارات عنيفة من الطيران الحربي الروسي على البلدة,2016-02-17 16:20:24+00:00,34.9376702,36.6298663,,RU_1161,Alleged civilian casualties from Russian attacks
Y-2qDMYfQAc,"Hama-South Hirbnafsah: violent raids from Russian warplanes on the town
",تجمع ثوار سوريا SRG,ريف حماه الجنوبي- حربنفسة : غارات عنيفة من الطيران الحربي الروسي على البلدة,2016-02-17 16:20:24+00:00,34.9376702,36.6298663,,RU_1162,Alleged civilian casualties from Russian attacks
s49cT_g7X-M,Watch intensive raids by the Russian warplanes on the outskirts city of Sheikh meskin and village Gaillah,مؤسسة شاهد الإعلامية-shahed media association,شاهد غارات مكثفة للطيران الحربي الروسي على اطراف مدينة الشيخ مسكين وقرية جعيلة,2016-02-17 13:32:55+00:00,32.827996,36.158238,DARAA : Sheikh Miskin,RU_1163,Alleged civilian casualties from Russian attacks
FCqd8g29nLs,Civil Defence finishing work and extracted the body of another nurse from the rubble of a hospital without borders,media.civildefense idlib,الدفاع المدني ينهي العمل ويستخرج آخر جثة لممرضة من تحت أنقاض مشفى بلا حدود 17-2-2016,2016-02-17 12:59:11+00:00,35.6478097,36.6679429,IDLIB : Maret Numan,RU_1164,Alleged civilian casualties from Russian attacks
Rtgvou6GwIA,"Civil Defence finishing searches in the hospital MSF Maarrat al-Nu'man
",SMART News Agency - وكالة سمارت للأنباء,الدفاع المدني ينهي عمليات البحث في مشفى أطباء بلا حدود بمعرة النعمان,2016-02-17 10:36:41+00:00,35.6478097,36.6679429,IDLIB : Maret Numan,RU_1165,Alleged civilian casualties from Russian attacks
EuPcFdOlpe4,Four air raids by the Russian warplanes on the city and the village of Al-Lataminah Maarkaba in Hama countryside,المركز الصحفي السوري-Syrian Press Centre,أربع غارات جوية شنها الطيران الحربي الروسي على مدينة اللطامنة وقرية معركبة في ريف حماة,2016-02-17 07:39:57+00:00,35.326749,36.621766,HAMA : latamneh,RU_1166,Alleged civilian casualties from Russian attacks
sw4J7VNGA-g,Russian warplanes shell the Maarkebbeh village of Hama northern countryside.,محمود الحموي-Mahmoud Alhamwi,الطيران الحربي الروسي يقصف قرية معركبة بريف حماة الشمالي 17 2 2016,2016-02-17 05:54:47+00:00,35.31813,36.6683854,HAMA : Mar kbeh,RU_1167,Alleged civilian casualties from Russian attacks
gdIqndUIR4g,Shelling by Russian warplanes on the Lattameneh city of Hama northern countryside.,محمود الحموي-Mahmoud Alhamwi,قصف بالطيران الحري الروسي على مدينة اللطامنة بريف حماة الشمالي 17 2 2016,2016-02-17 05:54:14+00:00,35.326749,36.621766,HAMA : latamneh,RU_1168,Alleged civilian casualties from Russian attacks
hWGxnyxEwzE,Watch Daraa in a moment of targeting the town Akrba raid of the Russian aviation,مؤسسة شاهد الإعلامية-shahed media association,شاهد درعا لحظة استهداف بلدة عقربا بغارة من الطيران الروسي,2016-02-17 00:02:41+00:00,33.1081569,36.0072227,IDLIB : Aqrabat,RU_1169,Alleged civilian casualties from Russian attacks
Tg1DOFzYeQc,Destruction in al dar al kabera as a result of the Russian airstrikes,Syrian Network for Human Rights,حمص – الدار الكبيرة: دمار جراء قصف الطيران الحربي يزعم أنه روسي القرية بالصواريخ 8 2 2016,2016-02-16 21:50:00+00:00,34.78751944,36.68223889,HOMS : Aldar alkabera,RU_1170,Alleged civilian casualties from Russian attacks
utsHiRn718E,Injured civilians including children as a result fo the Russian airstrikes in Homs,Syrian Network for Human Rights,حمص برج قاعي: جرحى جراء قصف الطيران الحربي يزعم أنه روسي القرية بالصواريخ 2 2 2016,2016-02-16 21:50:00+00:00,34.8817769,36.5768337,HOMS : Burj qai,RU_1171,Alleged civilian casualties from Russian attacks
jzB2v5Az9bU,"""Abu Badr"" Syrian citizen forced to flee the Russian bombardment of Tel Refaat after he was already displaced from his home in Aleppo city",مركز حلب الإعلامي AMC-Aleppo media centre,"""أبو بدر"" مواطن سوري أجبره القصف الروسي على النزوح من تل رفعت بعد نزوحه الأول من مدينته حلب",2016-02-16 17:27:02+00:00,36°28'36N,37°5′50″E,ALEPPO : Tal Rifaat,RU_1172,Alleged civilian casualties from Russian attacks
xcduy0JGf04,"Civil defense team working in place of the ruins of the Hospital Doctors Without Borders for the next day
",media.civildefense idlib,عمل فريق الدفاع المدني في مكان أنقاض مشفى أطباء بلا حدود لليوم التالي 16-2-2016,2016-02-16 17:19:41+00:00,35.6478097,36.6679429,IDLIB : Maret Numan,RU_1173,Alleged civilian casualties from Russian attacks
6VCiaJVjYl0,#Aleppo_News: Witness the moment airplanes of Russian aggressor target Ashrafieh neighbourhood with cluster bombs 16/2/2016,شبكة حلب نيوز - Halab News Network,#حلب_نيوز : شاهد لحظة استهداف طيران العدوان الروسي لحيّ الأشرفية بالقنابل العنقودية 2016/2/16,2016-02-16 17:15:37+00:00,36.228981,37.1344869,ALEPPO : Ashrafieh,RU_1174,Alleged civilian casualties from Russian attacks
COUp2UVwktk,The killing of five children by the Russian aircraft bombing al-Sakhur neighborhood of Aleppo 16/1/2016,مركز حلب الإعلامي AMC-Aleppo media centre,استشهاد خمسة أطفال جراء قصف الطيران الروسي على حي الصاخور بمدينة حلب 16-1-2016,2016-02-16 17:05:10+00:00,36.2203437,37.1804809,ALEPPO : Sakhour,RU_1175,Alleged civilian casualties from Russian attacks
jpf8cOzLBnY,The civil defense team is rescuing a nurse that works in Doctors without boarders hospital as she was injured as a result of the Russian attacks in Maret Numan,maara media center,فرق الدفاع المدني تستخرج ممرضة من كادر مشفى بلاد حدود كانت عالقة تحت الإنقاض إثر قصف الطائرات الروسية مشفى بلا حدود بريف إدلب,2016-02-16 13:56:55+00:00,35.6478097,36.6679429,IDLIB : Maret Numan,RU_1176,Alleged civilian casualties from Russian attacks
S2J7kpwV6_s,Monitoring the destruction left in the hospital of Azaz,Qasion News Agency EN,رصد الدمار الذي حل بالمشفى في مدينة اعزاز,2016-02-15 21:29:01+00:00,36.584381,37.049911,ALEPPO : Azaz,RU_1177,Alleged civilian casualties from Russian attacks
nlYatqV-1es,Qasioun news : first moments of bombardments on gathering of trucks in Ezaz city 15-2-2016,Qasion News Agency EN,اللحظات الأولى من القصف الذي استهدف موقف لتجمع الشاحنات في مدينة اعزاز 15-2-2016,2016-02-15 20:49:16+00:00,36.584381,37.049911,ALEPPO : Azaz,RU_1178,Alleged civilian casualties from Russian attacks
hJA4VuNURFg,Syria - Daraa countryside: Russian warplanes target a fuel depot belonging to a resident of Ghariyah al-Gharbiyah,SMO Syria,سوريا - ريف_درعا : الطيران الحربي الروسي يستهدف مستودع محروقات يعود لاحد الاهالي الغارية الغربية,2016-02-15 17:41:32+00:00,32.6830347,36.2054012,DARAA : Western Al-Ghariyah,RU_1179,Alleged civilian casualties from Russian attacks
sEb3D1ULZhE,"Huraytan || The devastation caused by the Russian air raids on the city
",المكتب الإعلامي حريتان-Harithan media centre,حريتان || آثار الدمار جراء الغارات الجوية الروسية على المدينة 15-2-2016,2016-02-15 17:08:12+00:00,36.287871,37.0838783,ALEPPO : Harithan,RU_1180,Alleged civilian casualties from Russian attacks
D17rkiI-m1U,Russian planes bombed a primary school in the Great Orme countryside of Aleppo,SMART News Agency - وكالة سمارت للأنباء,طائرات روسية تقصف مدرسة ابتدائية في اورم الكبرى بريف حلب,2016-02-15 17:00:36+00:00,36.15,36.95,ALEPPO : Urum al-Kubra,RU_1181,Alleged civilian casualties from Russian attacks
zSGIgr2bzKE,Idlib Press destruction Hospital Doctors Without Borders in Maart al noman by the Russian raids,Idleb Press,ادلب برس_دمار مشفى اطباء بلا حدود في معرة النعمان جراء الغارات الروسية,2016-02-15 16:43:11+00:00,35.6478097,36.6679429,IDLIB : Maret Numan,RU_1182,Alleged civilian casualties from Russian attacks
CXoIy3IKEso,Russian enemy in the dirtiest weapons cluster kills in Huraytan countryside of Aleppo,ShaamNetwork S.N.N,العدو الروسي في أقذر أسلحته العنقودي يفتك في حريتان بريف حلب,2016-02-15 16:34:49+00:00,36.287871,37.0838783,ALEPPO : Harithan,RU_1183,Alleged civilian casualties from Russian attacks
321-NNdBnUY,"Russian aviation destroys the hospital ""Doctors Without Borders"" and bombarding the National Hospital in Maart ..",معاذ الشامي-Muaz al shamy,"الطيران الروسي يدمر مشفى "" أطباء بلا حدود "" ويقصف المشفى الوطني في معرة النعمان ..",2016-02-15 16:23:50+00:00,35.6478097,36.6679429,IDLIB : Maret Numan,RU_1184,Alleged civilian casualties from Russian attacks
6_AlNClKgeE,Huraytan || Witness the moment the Russian warplanes targeting the city with cluster bombs,المكتب الإعلامي حريتان-Harithan media centre,حريتان || شاهد لحظة استهداف الطيران الحربي الروسي المدينة بالقنابل العنقودية 15-2-2016,2016-02-15 16:23:42+00:00,36.287871,37.0838783,ALEPPO : Harithan,RU_1185,Alleged civilian casualties from Russian attacks
pXqqDZprc7A,"Daraa, Ghariyah Sharkiyah: effects of shelling by Russian aircrafts.",ابو سندس الحوراني-Abo Sundos alhorany,درعا غارية شرقية آثار القصف بالطيران الروسي,2016-02-15 15:24:56+00:00,32.6783603,36.2606822,DARAA : Eastern Al-Ghariyah,RU_1186,Alleged civilian casualties from Russian attacks
OISn8swp9B4,Massacre in the #Doctors_Without_Borders Hospital after two Russian air strikes (were carried out) while searching for survivors under the rubble.,almarra today,لحظة استهداف مشفى أطباء بلا حدود في معرة النعمان بغارتين روسيتين خلال البحث عن ناجين تحت الأنقاض,2016-02-15 14:29:01+00:00,35.6478097,36.6679429,IDLIB : Maret Numan,RU_1187,Alleged civilian casualties from Russian attacks
fZjj1vQBI6w,"Russian warplanes targeting the civil defense team in Maart al-noman while working in a hospital, MSF",media.civildefense idlib,استهداف الطيران الروسي لفريق الدفاع المدني في معرة النعمان أثناء العمل في مشفى أطباء بلا حدود,2016-02-15 13:34:33+00:00,35.6478097,36.6679429,IDLIB : Maret Numan,RU_1188,Alleged civilian casualties from Russian attacks
xCDZ9idNSIw,"Huraytan || The devastation caused by the Russian air raids on the city
",المكتب الإعلامي حريتان-Harithan media centre,حريتان || آثار الدمار جراء الغارات الروسية على المدينة 15-2-2016,2016-02-15 12:41:25+00:00,36.287871,37.0838783,ALEPPO : Harithan,RU_1189,Alleged civilian casualties from Russian attacks
Ippm49iNXYY,"Aleppo northern countryside, #Azaz: wounded as a result of Russian bombardment on the city with ballistic missiles.",احرار اعزاز-Ahrar Azaz media network,ريف حلب الشمالي #اعزاز 15_2_2016. إصابات جراء القصف الروسي للمدينة بالصواريخ البالستية,2016-02-15 12:32:24+00:00,36.584381,37.049911,ALEPPO : Azaz,RU_1190,Alleged civilian casualties from Russian attacks
ai-QaE_FO9Q,Syrian Civil Defense Idlib: the side of the searches and rubble after air raids on the Hospital Doctors Without Borders,media.civildefense idlib,الدفاع المدني السوري ادلب : جانب من عمليات البحث و الانقاذ بعد غارات جوية على مشفى اطباء بلا حدود,2016-02-15 12:08:37+00:00,35.6478097,36.6679429,IDLIB : Maret Numan,RU_1191,Alleged civilian casualties from Russian attacks
xXmdMuDkhDU,Retrieving a victim from the national hospital in the Maarat Al Nouman city of Idlib province.,شبكة المعرة الآن-Maret network now,انتشال الشهداء من داخل المشفى الوطني في مدينة معرة النعمان بريف ادلب,2016-02-15 12:07:41+00:00,35.6478097,36.6679429,IDLIB : Maret Numan,RU_1192,Alleged civilian casualties from Russian attacks
dn7seKo2QQg,The moment Russian warplanes hover Ghariyah Sharkiyah.,ابو سندس الحوراني-Abo Sundos alhorany,لحظة تحليق للطيران الحربي الروسي فوق غارية شرقية,2016-02-15 11:56:24+00:00,32.6783603,36.2606822,DARAA : Eastern Al-Ghariyah,RU_1193,Alleged civilian casualties from Russian attacks
zGI-acvwThs,#Witness: Noon prayers at the Grand Sheikh Qassem Mosque in the town Hayan after it was completely destroyed by Russian bombardment,مركز حلب الإعلامي AMC-Aleppo media centre,#شاهد رفع أذان الظهر في جامع الشيخ قاسم الكبير في بلدة حيان بعد أن دمره القصف الروسي بشكل كامل,2016-02-15 11:47:44+00:00,36.3248097,37.0586887,ALEPPO : Hayyan,RU_1194,Alleged civilian casualties from Russian attacks
ROuFusO_Tt8,"Aleppo northern countryside, Azaz: some victims of Russian bombardment on Azaz and Kel Jebreen.",احرار اعزاز-Ahrar Azaz media network,ريف حلب الشمالي اعزاز 15_2_2016 بعض شهداء القصف الروسي على على اعزاز و كل جبرين,2016-02-15 11:43:12+00:00,36.584381,37.049911,ALEPPO : Azaz,RU_1195,Alleged civilian casualties from Russian attacks
EURnNCpgJs0,Targeting the Doctors Without Borders Hospital in the Maarat Al Nouman city of Idlib province.,شبكة المعرة الآن-Maret network now,استهداف مشفى أطباء بلا حدود في مدينة معرة النعمان بريف ادلب,2016-02-15 11:30:48+00:00,35.6478097,36.6679429,IDLIB : Maret Numan,RU_1196,Alleged civilian casualties from Russian attacks
glCMSSaOEgM,"Daraa, Ghariyah Sharkiyah: effects of shelling by Russian aircrafts.",ابو سندس الحوراني-Abo Sundos alhorany,درعا غارية شرقية آثار القصف بالطيران الروسي,2016-02-15 11:25:22+00:00,32.6783603,36.2606822,DARAA : Eastern Al-Ghariyah,RU_1197,Alleged civilian casualties from Russian attacks
b94Ffmx39BA,Qasioun News: Daraa: Russian warplanes hovering over Daraa city's airspace 15-2-2016,Qasion News Agency EN,وكالة قاسيون: درعا: تحليق الطيران الحربي الروسي في اجواء مدينة درعا 15-2-2016 ,2016-02-15 11:19:52+00:00,32.6228886,36.0819402,DARAA,RU_1198,Alleged civilian casualties from Russian attacks
lLuTnogAdkw,Civil Defense venue Russian raid on the hospital MSF Maart al-noman,media.civildefense idlib,الدفاع المدني مكان الغارة الروسية على مشفى أطباء بلا حدود في معرة النعمان,2016-02-15 10:57:36+00:00,35.6478097,36.6679429,IDLIB : Maret Numan,RU_1199,Alleged civilian casualties from Russian attacks
gU7TAvfR_4M,Targeting the Doctors Without Borders Hospital in the Maarat Al Nouman city with an air strike by Russian aircrafts.,almarra today,استهداف المشفى الوطني في مدينة معرة النعمان بغارة جوية من طيران العدوان الروسي 15-2-2016,2016-02-15 10:34:05+00:00,35.6478097,36.6679429,IDLIB : Maret Numan,RU_1200,Alleged civilian casualties from Russian attacks
UTsL_z35z6g,An air strike by regime warplanes targeted the perimeter of the National hospital in Maarat Al Nouman.,almarra today,غارة جوية لطيران النظام الحربي استهدفت محيط المشفى الوطني في مدينة معرة النعمان 15-2-2016,2016-02-15 10:31:07+00:00,35.6478097,36.6679429,IDLIB : Maret Numan,RU_1201,Alleged civilian casualties from Russian attacks
_g1I7GUSP-c,Destruction left by a surface-to-surface missile that hit the women's and children's hospital in Azaz city.,مكتب اعزاز الإعلامي-Azaz media centre,شاهد الدمار الذي خلفه سقوط صاروخ ارض ارض على مشفى النسائية والاطفال في مدينة اعزاز,2016-02-15 10:22:48+00:00,36.584381,37.049911,ALEPPO : Azaz,RU_1202,Alleged civilian casualties from Russian attacks
3HwA0-f__X0,"Aleppo northern cuntryside, Azaz: a child wounded in his leg as a result of Russian bombardment on the city.",احرار اعزاز-Ahrar Azaz media network,ريف حلب الشمالي #اعزاز إصابة طفل بكسر بقدمه جراء القصف الروسي للمدينة 15_2_2016,2016-02-15 10:21:34+00:00,36.584381,37.049911,ALEPPO : Azaz,RU_1203,Alleged civilian casualties from Russian attacks
HFBHohcgerQ,The martyrs and the wounded after the bombing of the Russian occupation airplanes hospital in the town of Maaret al-Numan countryside of Idlib,baladi- news,شهداء وجرحى إثر قصف طائرات الاحتلال الروسي مشفيين في مدينة معرة النعمان بريف إدلب 2016/2/15,2016-02-15 10:19:05+00:00,35.6478097,36.6679429,IDLIB : Maret Numan,RU_1204,Alleged civilian casualties from Russian attacks
IYE-pDQBYfY,Azaz: burnt relief vehicles and dead and wounded after it was targeted with cluster bombs.,مكتب اعزاز الإعلامي-Azaz media centre,اعزاز احتراق سيارات نقل الاغاثة وسقوط شهداء جرحى جراء استهدافها بالصواريخ العنقودية,2016-02-15 10:18:18+00:00,36.584381,37.049911,ALEPPO : Azaz,RU_1205,Alleged civilian casualties from Russian attacks
9nKPF4E6N6c,"Aleppo northern cuntryside, Azaz: a severely wounded case as a result of Russian bombardment on the city with ballistic missiles.",احرار اعزاز-Ahrar Azaz media network,ريف حلب الشمالي اعزاز إصابة خطرة جراء القصف الروسي للمدينة بالصواريخ البالستية 15_2_2016,2016-02-15 10:09:19+00:00,36.584381,37.049911,ALEPPO : Azaz,RU_1206,Alleged civilian casualties from Russian attacks
efJ4BHBUP18,"Dara Bosra Sham third airstrike of the Russian aviation
",شبكة بصرى الاخبارية-Bosra news network,درعا بصرى الشام الغارة الجوية الثالثة من الطيران الروسي 15/2/2016,2016-02-15 10:07:13+00:00,32.5168311,36.4446968,DARAA : Bosra,RU_1207,Alleged civilian casualties from Russian attacks
tqrmdEdv9TY,Dara Bosra Sham second airstrike of the Russian aviation on The city,شبكة بصرى الاخبارية-Bosra news network,درعا بصرى الشام الغارة الجوية الثانية من الطيران الروسي على المدينة 15/2/2016,2016-02-15 10:03:50+00:00,32.5168311,36.4446968,DARAA : Bosra,RU_1208,Alleged civilian casualties from Russian attacks
b-zvWWTgRoU,"Aleppo province, Azaz: wounded after ballistic missiles targeted the city.",احرار اعزاز-Ahrar Azaz media network,ريف حلب اعزاز إصابات جراء استهدف المدينة بالصواريخ البالستية 15_2_2016,2016-02-15 10:02:47+00:00,36.584381,37.049911,ALEPPO : Azaz,RU_1209,Alleged civilian casualties from Russian attacks
j176xNJnzGk,Dara Bosra Sham second airstrike of the Russian aviation on The city,شبكة بصرى الاخبارية-Bosra news network,درعا بصرى الشام الغارة الجوية الأولى من الطيران الروسي على المدينة 15/2/2016,2016-02-15 09:59:20+00:00,32.5168311,36.4446968,DARAA : Bosra,RU_1210,Alleged civilian casualties from Russian attacks
y7kU3W87tmM,Idlib | The second raid by the Russian Aviation on Hospital Doctors Without Borders after trying to rescue attempt remained outside the hospital,محمد الكنش-Mouhammed Alkhensh,إدلب | الغارة الثانية للطيران الروسي على مشفى أطباء بلاحدود بعد محاولة إنقاذ من بقي خارج المشفى,2016-02-15 08:00:01+00:00,35.6478097,36.6679429,IDLIB : Maret Numan,RU_1211,Alleged civilian casualties from Russian attacks
z678GHl3q2E,"Russian aviation targets Hospital Doctors Without Borders in the countryside of of Idlib
",Syrian Mirror,الطيران الروسي يستهدف مشفى أطباء بلا حدود في ريف إدلب,2016-02-15 07:54:24+00:00,35.6478097,36.6679429,IDLIB : Maret Numan,RU_1212,Alleged civilian casualties from Russian attacks
rp5FT7dZSnM,Idlib | Killed and wounded in a raid by warplanes on the Hospital Doctors Without Borders and scan the entire hospital,محمد الكنش-Mouhammed Alkhensh,إدلب | شهداء وجرحى بغارة للطيران الحربي على مشفى أطباء بلاحدود ومسح المشفى بالكامل,2016-02-15 07:48:01+00:00,35.6478097,36.6679429,IDLIB : Maret Numan,RU_1213,Alleged civilian casualties from Russian attacks
u5T-M1MJsFY,Shelling by Russian warplanes on the Lattameneh city of Hama northern countryside.,محمود الحموي-Mahmoud Alhamwi,قصف بالطيران الحربي الروسي على مدينة اللطامنة بريف حماة 15 2 2016,2016-02-15 05:43:11+00:00,35.326749,36.621766,HAMA : latamneh,RU_1214,Alleged civilian casualties from Russian attacks
W_Y8BREOJWo,Civil Defense members searching for survivors trapped under the rubble after Russian airstrikes on al-Katraji neighborhood Aleppo 14/2/2016,مركز حلب الإعلامي AMC-Aleppo media centre,الدفاع المدني يواصل البحث عن عالقين تحت الأنقاض بعد قصف الطائرات الروسية حي القاطرجي 14-2-2016,2016-02-14 19:41:27+00:00,"36°11'58""N","37°10'53""E",ALEPPO : Karam al-Qaterji,RU_1215,Alleged civilian casualties from Russian attacks
QtRlsDSZ_hI,"Step || Watch the effects of the devastation of in the town of Kafr Zita by the Russian air strikes
",Step News Agency,خطوة ||شاهد آثار الدمار الذي حل ببلدة كفرزيتا جراء الغارات الجوية الروسية,2016-02-14 17:11:51+00:00,35.373461,36.601458,HAMA : KafrZita,RU_1216,Alleged civilian casualties from Russian attacks
e5VhCL7iJc8,Russian enemy in the dirtiest weapons cluster kills in Huraytan countryside of Aleppo,ShaamNetwork S.N.N,شام ريف حلب عندان غارات مكثفة للطيران الحربي الروسي على البلدة 14 2 2016,2016-02-14 13:27:40+00:00,36.2924395,37.041918,ALEPPO : Anadan,RU_1217,Alleged civilian casualties from Russian attacks
eW2qb16luo0,Sham: Aleppo countryside: Tell Rifaat air support for Syrian Democratic Forces by Russian aircraft,ShaamNetwork S.N.N,شام ريف حلب تل رفعت تمهيد جوي لقوات سوريا الديموقراطية من قبل الطيران الروسي 14 2 2016,2016-02-14 13:01:34+00:00,36°28'36N,37°5′50″E,ALEPPO : Tal Rifaat,RU_1218,Alleged civilian casualties from Russian attacks
oj63ehyK-3M,Watch the flight of the Russian aviation Deraa in the countryside north Deraa today,مؤسسة شاهد الإعلامية-shahed media association,شاهد درعا تحليق الطيران الروسي في ريف درعا الشمالي اليوم,2016-02-14 12:52:22+00:00,32.6228886,36.0819402,DARAA,RU_1219,Alleged civilian casualties from Russian attacks
scBYc50MCXE,5 martyrs and twenty wounded Russian aviation bombed on village of Hosh Nasri Domaa eastern city during children going out from school,Yasser Doumany-ياسر الدوماني,5 شهداء وعشرين جريح بقصف بطيران الروسي على قرية حوش نصري شرق مدينة دومااثناء خروج طلاب المدرسة,2016-02-14 12:09:19+00:00,33.5709426,36.3968945,DAMASCUS : Duma,RU_1220,Alleged civilian casualties from Russian attacks
DijvAaL2oIY,Russian airforce in the sky over the eastern area of Daraa province.,SMO Syria,الطيران الروسي فوق سماء المنطقة الشرقية بريف درعا,2016-02-14 12:08:23+00:00,32.6228886,36.0819402,DARAA,RU_1221,Alleged civilian casualties from Russian attacks
jaiXuetBpdA,"Huraytan || Scenes strikes of Russian warplanes on the city's neighborhoods
",المكتب الإعلامي حريتان-Harithan media centre,حريتان || مشاهد للغارات من الطيران الحربي الروسي على أحياء المدينة 14-2-2016,2016-02-14 11:21:55+00:00,36.287871,37.0838783,ALEPPO : Harithan,RU_1222,Alleged civilian casualties from Russian attacks
oawcHWwe1QI,The destruction of residential property after Russian airstrikes on Duma,baladi- news,آثار الدمار الذي حلّ بالمنازل السكنية جراء قصف طيران الاحتلال الروسي مدينة دوما,2016-02-14 10:19:44+00:00,33.5709426,36.3968945,DAMASCUS : Duma,RU_1223,Alleged civilian casualties from Russian attacks
UO_6HtFq7cU,Russian warplanes flying over the Daraa eastern countryside.,SMO Syria,تحليق للطيراان الحربي الروسي في سماء ريف درعا الشرقي 14-2-2016,2016-02-14 09:40:09+00:00,32.6228886,36.0819402,DARAA,RU_1224,Alleged civilian casualties from Russian attacks
f-_1stscEj4,Qasioun News: Daraa: Russian warplanes mount airstrikes over Tal Alaqeyat area 13-2-2016,Qasion News Agency EN,وكالة قاسيون: درعا: الطيران الحربي الروسي ينفذ غارات جوية على منطقة تل العلاقيات 13-2-2016,2016-02-14 08:50:44+00:00,32.6228886,36.0819402,DARAA,RU_1225,Alleged civilian casualties from Russian attacks
AM3bLX7ib-4,Qasioun News: Homs: Destruction remnants caused by the Russian airstrikes over Rastan city 13-2-2016,Qasion News Agency EN,وكالة قاسيون: حمص: اثار الدمار جراء الغارات الجوية الروسية على مدينة الرستن 13-2-2016,2016-02-14 08:47:09+00:00,34.91639,36.733818,HOMS : Rastan,RU_1226,Alleged civilian casualties from Russian attacks
koiNaQZeFdc,"Houla, Kaiseen: signs of destruction in the village after it was subjected to air strikes by Russian aircrafts.",مركز حمص الإعلامي-Homs media centre,"tmp 2274 الحولة كيسين اثار الدمار في القرية بعد تعرضها لغارات من الطيران ‫الروسي 2 1284005407
",2016-02-14 08:31:44+00:00,34.9015456,36.6218176,,RU_1227,Alleged civilian casualties from Russian attacks
DxW-F3zEAeo,"Houla, Kaiseen: signs of destruction in the village after it was subjected to air strikes by Russian aircrafts.",مركز حمص الإعلامي-Homs media centre,tmp 2274 الحولة كيسين اثار الدمار في القرية بعد تعرضها لغارات من الطيران ‫الروسي 3 2141054542,2016-02-14 08:31:44+00:00,34.9015456,36.6218176,,RU_1228,Alleged civilian casualties from Russian attacks
_YCIrgkDzls,"Dara / Eastern Region | Monitoring the flight of Russian warplanes in the skies of the region
",فريـق الغـرايا الإعـلامي Al Ghraya Media Team,درعا / المنطقة الشرقية | رصد تحليق الطيران الحربي الروسي في سماء المنطقة 14.2.2016,2016-02-14 07:47:37+00:00,32.6783603,36.2606822,DARAA : Eastern Al-Ghariyah,RU_1229,Alleged civilian casualties from Russian attacks
NRc60522IM0,Effects of shelling by Russian aircrafts on Ghariyah Sharkiyah.,ابو سندس الحوراني-Abo Sundos alhorany,آثار القصف بالطيران الروسي على الغارية الشرقية,2016-02-14 05:00:06+00:00,32.6783603,36.2606822,DARAA : Eastern Al-Ghariyah,RU_1230,Alleged civilian casualties from Russian attacks
nH70E2PZONk,Air strikes carried out by the Russian occupation planes on Tal Refaat in northern countryside of Aleppo,وكالة شهبا برس Shahba Press Agency,الغارات الجوية التي نفذتها طائرات الاحتلال الروسي على تل رفعت في ريف حلب الشمالي.,2016-02-14 01:31:29+00:00,36°28'36N,37°5′50″E,ALEPPO : Tal Rifaat,RU_1231,Alleged civilian casualties from Russian attacks
anDn3VLS1pY,Step || Watch the intensive flight of Russain warplanes in the skies countryside of Idlib,Step News Agency,خطوة ||شاهد تحليق مكثف للطيران الحربي الروسي بسماء ريف إدلب,2016-02-13 17:57:38+00:00,35.9266549,36.6180588,IDLIB,RU_1232,Alleged civilian casualties from Russian attacks
movafi2bpZU,Agency Qassioun | One of victim's parents talking about the reason for the death of his son in a Russian raid on the city of Rastan in Homs ,Qasioun News Agency,وكالة قاسيون | أحد ذوي قتيل يتحدث عن سبب مقتله في غارة روسية على مدينة الرستن بحمص 13-2-2016,2016-02-13 15:38:03+00:00,34.91639,36.733818,HOMS : Rastan,RU_1233,Alleged civilian casualties from Russian attacks
08VX5DeXFeg,Important: the place where a rocket fired by Russian aircrafts landed in the Al Sawarah town of Daraa province.,SMO Syria,هام: مكان سقوط أحد صواريخ الطائرات الروسية في بلدة الصورة بريف درعا,2016-02-13 11:30:08+00:00,32.7496273,36.2609177,DARAA : Al soura,RU_1234,Alleged civilian casualties from Russian attacks
lHnzQUmKXNc,Agency Qassioun | The effects of the devastation in the city of hamoria result of air strikes by Russian warplanes,Qasioun News Agency,وكالة قاسيون| آثار الدمار في مدينة حمورية جراء الغارات الجوية من الطيران الحربي الروسي 12-2-2016,2016-02-12 16:06:21+00:00,33.5296468,36.3848593,DAMASCUS : Hammuriyah,RU_1235,Alleged civilian casualties from Russian attacks
oQoOf5WiS1M,Syria - Damascus suburb: a neavy air strike carried out by Russian warplanes on the Hammouriyeh area of Eastern Ghouta.,SMO Syria,سوريا - ريف_دمشق : غارة جوية عنيفة نفذها الطيران الحربي الروسي على بلدة حمورية في الغوطة الشرقية,2016-02-12 15:47:17+00:00,33.5296468,36.3848593,DAMASCUS : Hammuriyah,RU_1236,Alleged civilian casualties from Russian attacks
intxEUENJ2U,Syria - Damascus suburb: Russian warplanes flying over Eastern Ghouta.,SMO Syria,سوريا - ريف_دمشق : تحليق للطيران الحربي الروسي في سماء الغوطة الشرقية 12-2-2016,2016-02-12 14:50:55+00:00,33.5296468,36.3848593,DAMASCUS : Eastern Ghouta,RU_1237,Alleged civilian casualties from Russian attacks
eTcgrM55B_k,Destruction in houses and residential neighborhoods in the Kafarbatna suburb after it was targeted by Russian warplanes.,SMO Syria,دمار المنازل والأحياء السكنية في مدينة كفربطنا إثر إستهدافها من قبل الطيران الحربي الروسي,2016-02-12 13:54:17+00:00,33.514295,36.373479,DAMASCUS : Kafar Batna,RU_1238,Alleged civilian casualties from Russian attacks
8WaTcbH-aOw,Four air raids by the Russian warplanes on the city Kafr Zita in Hama countryside ,المركز الصحفي السوري-Syrian Press Centre,أربع غارات جوية شنها الطيران الحربي الروسي على مدينة كفرزيتا بريف حماة,2016-02-12 13:46:35+00:00,35.373461,36.601458,HAMA : KafrZita,RU_1239,Alleged civilian casualties from Russian attacks
oyeXCgAzVmQ,Sham Deraa Naemeh martyrs by the Russian aviation bombarded video too harsh warning P1,ShaamNetwork S.N.N,شام درعا النعيمة شهداء بقصف للطيران الروسي 12 2 2016 تحذير الفيديو قاسي جداً جـ1,2016-02-12 13:21:41+00:00,32.63574722,36.15920556,DARAA : Al naymah,RU_1240,Alleged civilian casualties from Russian attacks
eZ0BNxAlN3c,Sham Al-Ghantu Homs massacre against the civilian aviation bombarded the Russian video warning very tough P4,ShaamNetwork S.N.N,شام حمص الغنطو مجزرة بحق المدنيين بقصف للطيران الروسي 12 2 2016 تحذير الفيديو قاسي جداً ج4,2016-02-12 12:11:21+00:00,34.8223907,36.6935635,HOMS : Al-Ghantu,RU_1241,Alleged civilian casualties from Russian attacks
z-9JISCtiyQ,"Sham Al-Ghantu Homs massacre against the civilian aviation bombarded the Russian video warning very tough p3
",ShaamNetwork S.N.N,شام حمص الغنطو مجزرة بحق المدنيين بقصف للطيران الروسي 12 2 2016 تحذير الفيديو قاسي جداً ج3,2016-02-12 12:11:13+00:00,34.8223907,36.6935635,HOMS : Al-Ghantu,RU_1242,Alleged civilian casualties from Russian attacks
20QlVvnsYqc,The destruction in Kafer Khasher village in the northern countryside of Aleppo following bombing by Russian aircraft,baladi- news,آثار الدمار في قرية كفر خاشر بريف حلب الشمالي بعد قصفها من قبل طيران الاحتلال الروسي,2016-02-12 09:51:19+00:00,36°32'51.44,37° 3'46.23,ALEPPO : Kafer Khasher,RU_1243,Alleged civilian casualties from Russian attacks
O6vbohY4kGs,Al-Ghantu Homs civilians wounded by the strikes of the aviation Russian occupation to revive town,motasem homs,الغنطو حمص جرحى المدنين جراء الغارات من الطيران الاحتلال الروسي على احياء البلدة12/2/2016,2016-02-12 07:41:23+00:00,34.8223907,36.6935635,HOMS : Al-Ghantu,RU_1244,Alleged civilian casualties from Russian attacks
JvBgMBPTGSY,Al-Ghantu Homs important moment steric rocket blast by the Russian occupation aircrafts in the revival of the town 12/2,motasem homs,الغنطوحمص هااام لحظة انفجار الصواريخ الفراغية من طيران الاحتلال الروسي في احياء البلدة12/2,2016-02-12 07:19:19+00:00,34.8223907,36.6935635,HOMS : Al-Ghantu,RU_1245,Alleged civilian casualties from Russian attacks
DKZwEijGIP4,Transporting wounded after Russian warplanes targeted Ghantoo village.,شبكة تلبيسة مباشر-Talbisah network,نقل جرحى نتيجة استهداف الحربي الروسي لقرية الغنطو,2016-02-12 06:21:15+00:00,34.8223907,36.6935635,HOMS : Al-Ghantu,RU_1246,Alleged civilian casualties from Russian attacks
0xpUa9iQobs,Tell Rifaat || The devastation caused by the targeting of Tell Rifaat City with dozens of air raids by Russian aircraft,مدينة تل رفعت Tall Refaat City,تل رفعت || آثار الدمار جرآء استهداف مدينة تل رفعت بعشرات الغارات الجوية من الطيران الروسي,2016-02-11 17:32:48+00:00,36°28'36N,37°5′50″E,ALEPPO : Tal Rifaat,RU_1247,Alleged civilian casualties from Russian attacks
FoPKdq5U0Gk,Russian warplanes bombed the cities of Al-Lataminah Mork and Kafr Zita in Hama countryside,المركز الصحفي السوري-Syrian Press Centre,قصف الطيران الروسي على اللطامنة,2016-02-11 12:20:57+00:00,35.326749,36.621766,HAMA : latamneh,RU_1248,Alleged civilian casualties from Russian attacks
BC4coP8KjLU,The moment Ghariyah Al Sharkiyah town is targeted by Russian aircrafts.,ابو سندس الحوراني-Abo Sundos alhorany,لحظة استهداف بلدة الغارية الشرقية بالطيران الروسي,2016-02-11 10:11:54+00:00,32.6783603,36.2606822,DARAA : Eastern Al-Ghariyah,RU_1249,Alleged civilian casualties from Russian attacks
FgZFAxGGUR8,The moment Ghariyah Al Sharkiyah town is targeted by Russian aircrafts.,ابو سندس الحوراني-Abo Sundos alhorany,لحظة استهداف بلدة الغارية الشرقية بالطيران الروسي,2016-02-11 10:04:59+00:00,32.6783603,36.2606822,DARAA : Eastern Al-Ghariyah,RU_1250,Alleged civilian casualties from Russian attacks
znMimpTw_h4,Shelling by Russian warplanes on the Kafarzeta city of Hama northern countryside.,محمود الحموي-Mahmoud Alhamwi,قصف بالطيران الحربي الروسي على مدينة كفرزيتا بريف حماة 11 2 2016,2016-02-11 10:02:04+00:00,35.373461,36.601458,HAMA : KafrZita,RU_1251,Alleged civilian casualties from Russian attacks
L75rsYy2JPE,Effects of shelling by Russian aircrafts on Ghariyah Sharkiyah.,ابو سندس الحوراني-Abo Sundos alhorany,آثار القصف بالطيران الروسي على الغارية الشرقية,2016-02-11 09:19:06+00:00,32.6783603,36.2606822,DARAA : Eastern Al-Ghariyah,RU_1252,Alleged civilian casualties from Russian attacks
t8z48Nvy_zA,Teir Maalah Homs raids of aviation Russian occupation for more than twenty raid at night,motasem homs,تيرمعلةحمص غارات من طيران الاحتلال الروسي ليلا بأكثرمن عشرين غارة 11/2/2016,2016-02-11 07:34:57+00:00,34.8015188,36.7085659,HOMS : Ter Maela,RU_1253,Alleged civilian casualties from Russian attacks
wfeO7sgE4k0,Idlib Press camera roaming among the victims of Russian bombing in Efes town camp in Idlib countryside P2,Idleb Press,كمرة ادلب برس تتجول بين ضحايا القصف الروسي في مخيم بلدة أفس بريف ادلب ج2,2016-02-10 21:00:42+00:00,35.906098,36.8039983,IDLIB : Afes,RU_1254,Alleged civilian casualties from Russian attacks
YnICy5IaGdU,Idlib Press camera roaming among the victims of Russian bombing in Efes town camp in Idlib countryside P1,Idleb Press,كمرة ادلب برس تتجول بين ضحايا القصف الروسي في مخيم بلدة أفس بريف ادلب ج1,2016-02-10 21:00:23+00:00,35.906098,36.8039983,IDLIB : Afes,RU_1255,Alleged civilian casualties from Russian attacks
XGZEmaISld0,"Huraytan || The devastation caused by strikes of Russian warplanes on the city
",المكتب الإعلامي حريتان-Harithan media centre,حريتان || آثار الدمار جراء الغارات من الطيران الحربي الروسي على المدينة 10-2-2016,2016-02-10 16:23:53+00:00,36.287871,37.0838783,ALEPPO : Harithan,RU_1256,Alleged civilian casualties from Russian attacks
KiMudh0xMQc,Syria - Damascus suburb: Russian warplanes hovering and the moment they carried out an air strike on Saida town.,SMO Syria,سوريا - ريف_درعا : تحليق الطيران الحربي الروسي و لحظة تنفيذ الغارة الجوية على بلدة صيدا,2016-02-10 15:01:51+00:00,32.629092,36.2236833,IDLIB : Basaida,RU_1257,Alleged civilian casualties from Russian attacks
dWoy6OqIOvQ,Video showing the parachute of a cluster bomb dropped on Duma in Damscus countryside 10/2/2016,baladi- news,فيديو يظهر مظلة أحد الصواريخ العنقودية التي قُصفت بها مدينة دوما بريف دمشق 2016/2/10,2016-02-10 14:34:29+00:00,33.5709426,36.3968945,DAMASCUS : Duma,RU_1258,Alleged civilian casualties from Russian attacks
yiMWwim-ZDM,Talbiseh is a very important moment of the fall of the Russian aircraft missile in front of the ambulance,talbisa h,تلبيسة هام جدا لحظة سقوط صاروخ الطائرة الروسية امام سيارة الاسعاف 9 2 2016,2016-02-10 13:15:49+00:00,34.833601,36.735749,HOMS : Talbisah,RU_1259,Alleged civilian casualties from Russian attacks
0sdav2Lpnc4,Effects of shelling by Russian aircrafts on Ghariyah Sharkiyah.,ابو سندس الحوراني-Abo Sundos alhorany,آثار القصف بالطيران الروسي على الغارية الشرقية,2016-02-10 11:09:27+00:00,32.6783603,36.2606822,DARAA : Eastern Al-Ghariyah,RU_1260,Alleged civilian casualties from Russian attacks
nUdREoPFfB4,Effects of shelling by Russian aircrafts on Ghariyah Sharkiyah.,ابو سندس الحوراني-Abo Sundos alhorany,آثار القصف بالطيران الروسي على الغارية الشرقية,2016-02-10 10:54:50+00:00,32.6783603,36.2606822,DARAA : Eastern Al-Ghariyah,RU_1261,Alleged civilian casualties from Russian attacks
KWNmk0_KBnY,The moment Ghariyah Al Sharkiyah town is targeted by Russian aircrafts.,ابو سندس الحوراني-Abo Sundos alhorany,لحظة استهداف بلدة الغارية الشرقية بالطيران الروسي,2016-02-10 10:44:02+00:00,32.6783603,36.2606822,DARAA : Eastern Al-Ghariyah,RU_1262,Alleged civilian casualties from Russian attacks
UJ82t9pyCjo,The moment Ghariyah Al Sharkiyah town is targeted by a second air strike.,ابو سندس الحوراني-Abo Sundos alhorany,لحظة استهداف بلدة الغاريةشرقية بغارة جوية ثانية,2016-02-10 10:38:54+00:00,32.6783603,36.2606822,DARAA : Eastern Al-Ghariyah,RU_1263,Alleged civilian casualties from Russian attacks
Hv-76qiviaw,Five year old girl Maysam says that Russian aircrafts shelled her home in Kafar Kalbeen.,احرار اعزاز-Ahrar Azaz media network,ميسم بنت الخمسة اعوام تقول ان الطائرت الروسية من قصفت منزلها في كفر كلبين 9-2-2016,2016-02-09 20:48:16+00:00,36.584381,37.049911,ALEPPO : Azaz,RU_1264,Alleged civilian casualties from Russian attacks
fm4kKEcOT04,"More than 100 thousand civilians displaced by the Russian airline after the military campaign in the northern Aleppo countryside ..
",معاذ الشامي-Muaz al shamy,أكثر من 100 ألف مدني هجرهم الطيران الروسي بعد الحملة العسكرية على ريف حلب الشمالي ..,2016-02-09 20:25:02+00:00,36.584381,37.049911,ALEPPO : Azaz,RU_1265,Alleged civilian casualties from Russian attacks
2oiqZu_Em_U,The moment Russian occupation aircraft targeted civilian houses in Tel Refaat in Aleppo countryside on Tuesday,وكالة شهبا برس Shahba Press Agency,لحظة استهداف طائرات الاحتلال الروسي منازل المدنيين في مدينة تل رفعت بريف حلب اليوم الثلاثاء,2016-02-09 20:02:02+00:00,36°28'36N,37°5′50″E,ALEPPO : Tal Rifaat,RU_1266,Alleged civilian casualties from Russian attacks
nTJLESHmmkQ,"Aleppo - Kafr Naya || Devastation caused by Russian warplanes bombing Kafar Naya
",مدينة تل رفعت Tall Refaat City,ريف حلب - كفرنايا || أثار الدمار الذي خلفه قصف الطيران الحربي الروسي على بلدة كفرنايا,2016-02-09 19:24:45+00:00,36°28'36N,37°5′50″E,ALEPPO : Tal Rifaat,RU_1267,Alleged civilian casualties from Russian attacks
NfrG4Uif1Nc,"Tell Rifaat || Russian air air raids which targeted civilian houses in Tel Refaat City
",مدينة تل رفعت Tall Refaat City,تل رفعت || الغارات الجوية الروسية التي استهدفت منازل المدنيين في مدينة تل رفعت 09-02-2016,2016-02-09 18:46:13+00:00,36°28'36N,37°5′50″E,ALEPPO : Tal Rifaat,RU_1268,Alleged civilian casualties from Russian attacks
k1VwWBSeE_o,"Tell Rifaat || Devastation caused by the barbaric Russian bombardment on the city of Tel Refaat
",مدينة تل رفعت Tall Refaat City,تل رفعت || آثار الدمار الذي خلفه القصف الروسي الهمجي على مدينة تل رفعت 09-02-2016,2016-02-09 18:06:49+00:00,36°28'36N,37°5′50″E,ALEPPO : Tal Rifaat,RU_1269,Alleged civilian casualties from Russian attacks
1bN7rXeJeoo,"Tell Rifaat || Injured civilians as a result of successive barbaric strikes by Russian warplanes
",مدينة تل رفعت Tall Refaat City,تل رفعت || جرحى من المدنيين جرآء الغارات الهمجية المتتالية من الطيران الحربي الروسي,2016-02-09 17:55:04+00:00,36°28'36N,37°5′50″E,ALEPPO : Tal Rifaat,RU_1270,Alleged civilian casualties from Russian attacks
B1Gt-RbgiOw,"Tell Rifaat || Successive raids on the city of Tel Refaat from Russian warplanes and devastation caused by the bombing
",مدينة تل رفعت Tall Refaat City,تل رفعت || الغارات المتتالية على مدينة تل رفعت من الطيران الحربي الروسي والدمار الذي خلفه القصف,2016-02-09 17:19:44+00:00,36°28'36N,37°5′50″E,ALEPPO : Tal Rifaat,RU_1271,Alleged civilian casualties from Russian attacks
ip8XD75az8s,The destruction in the city of Mare Aleppo countryside result of shelling by Russian occupation warplanes,وكالة شهبا برس Shahba Press Agency,دمار في مدينة مارع بريف حلب جراء قصفها بطيران الاحتلال الروسي,2016-02-09 17:14:52+00:00,36.4814643,37.1968431,ALEPPO : Mar'e,RU_1272,Alleged civilian casualties from Russian attacks
XtNo0TQOZF4,Step || Watch the effects of the destruction in the town of Telmns by the Russian air strikes which led to elevate 6 people,Step News Agency,خطوة ||شاهد آثار الدمار ببلدة تلمنس جراء الغارات الجوية الروسية مما أدى إلى ارتقاء 6 أشخاص,2016-02-09 15:58:43+00:00,35.6366159,36.7405315,IDLIB : Talmenes,RU_1273,Alleged civilian casualties from Russian attacks
pRorj8F8gEA,"Russian warplanes targeting the Tiniyah city camp in the countryside of Idlib, which was established by the Qatari Red Crescent",Step News Agency,استهداف الطيران الروسي مخيم المدينة الطينية بريف ادلب والذي انشأ من قبل الهلال الأحمر القطري,2016-02-09 15:51:27+00:00,35.9266549,36.6180588,IDLIB,RU_1274,Alleged civilian casualties from Russian attacks
7PGLlnxWy3E,8 killed in a Russian raid on a gathereing of displaced people in the countryside of Idlib,SMART News Agency - وكالة سمارت للأنباء,8 قتلى في غارة روسية على تجمع للنازحين في ريف إدلب,2016-02-09 15:18:48+00:00,35.9266549,36.6180588,IDLIB,RU_1275,Alleged civilian casualties from Russian attacks
UsG7SVhOzyc,The moment Ghariyah Al Sharkiyah is targeted by Russian aircrafts.,ابو سندس الحوراني-Abo Sundos alhorany,لحظة استهداف بلدة الغارية الشرقية بالطيران الروسي,2016-02-09 14:45:32+00:00,32.6783603,36.2606822,DARAA : Eastern Al-Ghariyah,RU_1276,Alleged civilian casualties from Russian attacks
oRIp-K-eOEs,Effects of shelling by Russian aircrafts on Ghariyah Sharkiyah.,ابو سندس الحوراني-Abo Sundos alhorany,آثار القصف بالطيران الروسي على الغارية الشرقية,2016-02-09 14:31:31+00:00,32.6783603,36.2606822,DARAA : Eastern Al-Ghariyah,RU_1277,Alleged civilian casualties from Russian attacks
nkloCw0TmA0,Al Ghariya eastern moment targeting the town with military aircrafts,فريـق الغـرايا الإعـلامي Al Ghraya Media Team,الغارية الشرقية 9.2.2016 لحظة استهداف البلدة بالطيران الحربي,2016-02-09 14:04:32+00:00,32.6783603,36.2606822,DARAA : Eastern Al-Ghariyah,RU_1278,Alleged civilian casualties from Russian attacks
GyNUdbdMIRs,eastern Al Ghariya effects of targeting the town with military aircrafts,فريـق الغـرايا الإعـلامي Al Ghraya Media Team,الغارية الشرقية 9.2.2016 آثار استهداف البلدة بالطيران الحربي,2016-02-09 14:02:22+00:00,32.6783603,36.2606822,DARAA : Eastern Al-Ghariyah,RU_1279,Alleged civilian casualties from Russian attacks
9z9rv33YFKY,Aleppo News: Destruction caused by Russian missile strike on al-Atareb in Aleppo countryside 8/2/2016,شبكة حلب نيوز - Halab News Network,حلب نيوز: الدمار الذي تسببه سقوط صاروخ من الطيران الروسي على الأتارب بريف حلب 8/2/2016,2016-02-09 07:52:24+00:00,36.1393709,36.8234774,ALEPPO : Al atarib,RU_1280,Alleged civilian casualties from Russian attacks
ka7Ty0Qo2X8,More than two dozen air strike on Al-Lataminah cities and Kvrenbaudh Kafr Zita in Hama countryside ,المركز الصحفي السوري-Syrian Press Centre,قصف الطيران الروسي على اللطامنة,2016-02-09 05:42:41+00:00,35.326749,36.621766,HAMA : latamneh,RU_1281,Alleged civilian casualties from Russian attacks
WPGUemb3jjw,Talbiseh in and around raids by the Russian occupation fly at night and the violent explosions shake the city,motasem homs,تلبيسة وما حولها غارات من طيران الاحتلال الروسي ليلا والانفجارات العنيفة تهز المدينة9/2/2016,2016-02-08 23:33:43+00:00,34.833601,36.735749,HOMS : Talbisah,RU_1282,Alleged civilian casualties from Russian attacks
gYhrplHak_A,"Talbiseh a little girl came out from under the rubble alive
",talbisa h,تلبيسة 9 2 2016 طفلة صغيرة أخرجت من تحت الأنقاض حية,2016-02-08 23:20:51+00:00,34.833601,36.735749,HOMS : Talbisah,RU_1283,Alleged civilian casualties from Russian attacks
BeDaR-CBd-I,"Talbiseh moments of terrifying instant a rocket in front of photographer
",talbisa h,تلبيسة 9 2 2016 لحظات مرعبة لحظة سقوط الصاروخ أمام المصور,2016-02-08 23:18:21+00:00,34.833601,36.735749,HOMS : Talbisah,RU_1284,Alleged civilian casualties from Russian attacks
uPdRPvKXYwQ,Syria - Daraa countryside: Russian airstrike on Alma village during night 8/2/2016,SMO Syria,سوريا - ريف_درعا : الغارات الجوية الروسية على بلدة علما ليلاً 8-2-2016,2016-02-08 19:16:17+00:00,32.7483333,36.2416667,DARAA : Elma,RU_1285,Alleged civilian casualties from Russian attacks
gCCKKilmt3s,Qassioun News: Aleppo: Russian airstrikes hit Atareb city last night 8-2-2016,Qasion News Agency EN,وكالة قاسيون: حلب: غارات جوية روسية على مدينة الاتارب الليلة الماضية 8-2-2016,2016-02-08 17:20:14+00:00,36.1393709,36.8234774,ALEPPO : Al atarib,RU_1286,Alleged civilian casualties from Russian attacks
wrdfTwRYDnA,"SMART monitors the two types of cluster bombs, which Russian aircraft bombing on the northern Homs",SMART News Agency - وكالة سمارت للأنباء,سمارت ترصد نوعين من القنابل العنقودية التي تلقيها الطائرات الروسية على ريف حمص الشمالي,2016-02-08 17:19:40+00:00,34.833601,36.735749,HOMS : Talbisah,RU_1287,Alleged civilian casualties from Russian attacks
I4esvwaXaoA,The massacre of  Al-Salhen neighborhood in  Aleppo by aerial bombardment on the market for the street vendors,SMART News Agency - وكالة سمارت للأنباء,مجزرة في حي الصالحين بحلب في قصف جوي على سوق للباعة المتجولين,2016-02-08 17:04:53+00:00,36.1846864,37.1358516,ALEPPO : Salaheen,RU_1288,Alleged civilian casualties from Russian attacks
1-Ngk0OWjic,18 killed and dozens wounded in massacre by warplanes in al-Salhin and al-Kallaseh neighborhoodand and elements of Civil Defence recovering victims and wounded,الدفاع المدني السوري حلب-Aleppo civil defense,18 شهيد وعشرات الجرحى في مجزرة للطيران الحربي على حي الصالحين والكلاسة وعناصر الدفاع المدني يقومون بانتشال الضحايا واسعاف الجرحى,2016-02-08 14:49:01+00:00,36.1895072,37.1464061,,RU_1289,Alleged civilian casualties from Russian attacks
jQpDA-NBx6E,Effects of shelling by Russian aircrafts on Ghariyah Al Sharkiyah town.,ابو سندس الحوراني-Abo Sundos alhorany,آثار القصف بالطيران الروسي على بلدة الغارية الشرقي,2016-02-08 13:32:42+00:00,32.6783603,36.2606822,DARAA : Eastern Al-Ghariyah,RU_1290,Alleged civilian casualties from Russian attacks
Bdg1WGy2P3c,Russian warplanes shell the Lattameneh city of Hama province.,محمود الحموي-Mahmoud Alhamwi,الطيران الحربي الروسي يقصف مدينة اللطامنة بريف حماة 8 2 2016,2016-02-08 11:44:51+00:00,35.326749,36.621766,HAMA : latamneh,RU_1291,Alleged civilian casualties from Russian attacks
YggfqXNPMYk,Russian airstrike in Anadan,Step News Agency,قصف الطيران الروسي في عندان,2016-02-08 11:39:05+00:00,36.2924395,37.041918,ALEPPO : Anadan,RU_1292,Alleged civilian casualties from Russian attacks
ZP4Z-IQo4Gg,Qasioun news : destruction in Harytan city due to Russian airstrikes 7-2-2016,Qasion News Agency EN,وكالة قاسيون: الدمار في مدينة حريتان جراء الغارات الجوية الروسية 7-2-2016,2016-02-07 20:09:06+00:00,36.287871,37.0838783,ALEPPO : Harithan,RU_1293,Alleged civilian casualties from Russian attacks
MUXoQwi77-E,"Hundreds of families from the countryside north of Aleppo to remove stretched out on the open air on the Turkish border to escape the barbaric Russian bombardment.
",baladi- news,مئات العوائل من ريف حلب الشمالي لازالت تفترش العراء على الحدود التركية هربا من القصف الروسي الهمجي.,2016-02-07 19:22:10+00:00,36.584381,37.049911,ALEPPO : Azaz,RU_1294,Alleged civilian casualties from Russian attacks
